Num,Post,Date,Like,Like_ID,Share,Share_ID,Share_Content,Comment,Comment_ID,Comment_Content1168,【这些水果的单词你都会说吗？】柠檬 lemon；柿子persimmon；石榴 pomegranate；菠萝蜜 jackfruit；榴莲 durian；火龙果 dragon fruit/pitahaya；猕猴桃 kiwi fruit ；荔枝 litchi；香瓜 musk melon；李子 plum；杨梅 waxberry；杨桃starfruit；枇杷 loquat. [转] ​​​,2014-1-16,1,"['5208060272', '2971779755', '1976186035', '2870381264', '3695889094', '2187639723', '1862350177', '1668891531', '1150223210']",2,"['2405985095', '2566700360', '2085220932', '5208060272', '2369366557', '3837587319', '2600852531', '5102992458', '5016785134', '1722911174']",:转发微博 $: 水果的单词[心]每天学点英语单词[太开心] $:水果的单词[心]每天学点英语单词[太开心] $:转发微博 $:转发微博 $:水果的单词[心]每天学点英语单词[太开心] $:转发微博 $:转发微博 $:水果的单词[心]每天学点英语单词[太开心] $:转发微博 ,1,"['3873433545', '1971497913', '3624905593', '3172907662', '2563394227', '3504169843', '1717248304', '1790725554']",转发微博$蒽!$转发微博$ $转发微博$[黑线][黑线][黑线]$[挖鼻屎]$:[哼][哼][哼][哼][哼][哼]
1169,刚把微博玩转，大家又流行玩微信了，好吧好吧，跟上潮流，我们的微信号是391275871 欢迎加我哦。 ​​​,2014-1-15,0,[],1,[],,0,[],
1170,分享女青年的启蒙机构网站：http://t.cn/8kJFZxV 香港社区伙伴，有助于了解社区支持农业，农村可持续等等 ​​​,2014-1-15,0,[],0,[],,0,[],
1171,今晚男青年掌勺的凉拌土豆丝，用的红皮土豆，脆爽，开胃，年夜饭镇桌菜就它了! 我在:民生路 ​​​,2014-1-15,0,[],0,[],,0,[],
1172,大舅子胖哥的土猪肉腊肉算是快好了...香。[爱你][爱你][爱你] 我自家的还在晒...好吃稳得住...[汗][汗][汗] ​​​,2014-1-15,0,[],0,[],,2,"['579922049', '2752085727', '2135131685']",孩奶奶家每年至少一头猪，可是没有人做成腊肉腊肠，那肥肉实在难以下咽，搞得我真的希望猪都长瘦肉多好（估计瘦肉精就是为我这种人发明的[哈哈]）如果做成这样就好吃多了，下一步一定要学会做腊肠腊肉。$风干晒干的没有烟熏的好吃。。。个人口味〜〜〜$流口水呀[馋嘴]
1173,今晚男青年掌勺的凉拌土豆丝，用的红皮土豆，脆爽，开胃，年夜饭镇桌菜就它了! 我在:民生路 ​​​,2014-1-15,0,[],1,['579922049'],:直接拌吗？需要焯熟吗？ ,2,"['579922049', '1707826943']",:要焯的，不要过火，透明了，尝尝脆脆的，没有生土豆味就可以了，捞出来过凉水。再拌。$直接拌吗？需要焯熟吗？
1174,还有没几天快递就停止接单了，想囤土豆的亲抓紧了，而且年后运费就恢复原价了哦，详情请戳：快乐返乡青年生态农场 再此提醒各位亲，请仔细阅读俺家宝贝的保存说明，过年有一盘爽口的土豆丝在大鱼大肉之间，必定大受欢迎啊[挤眼][鼓掌] ​​​,2014-1-15,0,[],0,[],,0,[],
1175,《年货推荐，所荐都是我吃过并且了解生产方式的。》真正好的食物吃过之后的一个星期甚至一个月后你都会想起它，我选择的这些食物基本都是我去探访过的农场种植、养殖和无添加制作的成品。在此，要感谢北京有机农夫市集这一平台，你们搭建了生态农户和消费者之...畅读版【http://t.cn/8FAi7CS】 ​​​,2014-1-14,1,"['2658361251', '1666799764', '1688419180', '3182890747', '2264833607', '1802281152', '2390198685', '2680328045', '1594792651']",3,"['3526205393', '3228708964', '3153891960', '2525386924', '1872713742', '2703530915', '1443932853', '3044220760', '3045412114']",: 转发微博 $: 转发微博 $:转发微博 $ 的。 $ 吃好点 $ 的。 $: 留着有机会尝尝 $: 留着有机会尝尝 $: 留着有机会尝尝 ,0,[],
1176,感谢南方农村报二王的工作，与大家交流 。欢迎批评指正！@毕慧芳农业 @成都纳雅山庄 @四川狼哥X9 @肖与 @蒜妞儿 @慧敏爱农业@食品界姜昆  \＂新农人＂代表农业产业发展的方向-要闻-南方农村报 1月11日，围绕我国生态农业发展和 http://t.cn/8FLLWUf  ​​​,2014-1-14,0,[],0,[],,0,[],
1177,亚麻籽粉的吃法很多，炒菜，凉拌菜里都可放。还可以拌面，拌粥，放豆浆里，蒸花卷，烙饼里都可以放！为了身体来看看吧！@北京有机农夫市集 ...畅读版【http://t.cn/8F28y3u】 ​​​,2014-1-13,3,"['5144658354', '1275517283', '2092832017']",14,"['1915845361', '579922049', '1455991523', '1498665415', '1910340127', '1668758182']",:转发微博 $:亚麻籽粉，您尝试过吗，老少咸宜，营养丰富，保健佳品！ $:转发微博 $: 这些我都不知道，但是，亚麻籽很香～很香～就像芝麻似的，真的很好吃，适合放到各种糊糊里[嘻嘻] 烙饼[嘻嘻] 都好吃～～～[嘻嘻] $: 这些我都不知道，但是，亚麻籽很香～很香～就像芝麻似的，真的很好吃，适合放到各种糊糊里[嘻嘻] 烙饼[嘻嘻] 都好吃～～～[嘻嘻] $:这些我都不知道，但是，亚麻籽很香～很香～就像芝麻似的，真的很好吃，适合放到各种糊糊里[嘻嘻] 烙饼[嘻嘻] 都好吃～～～[嘻嘻] ,4,"['579922049', '2305260445', '2831940763', '1455991523']",:一般的勺子，每天一勺就够了$每人每天吃多少合适？之前买了一包，吃过几次，孩子特别喜欢吃，可是我怕吃多了也不好$ $转发微博
1178,#晒鸡蛋#我家现在有四种鸡蛋，[威武]从右至左：孩儿姥姥家的，孩儿奶奶家的，@乐活村-乐活先生 的，某某雁蛋，雁蛋是朋友的朋友送的，名字忘了，是三个字，健康好鸡蛋，小朋友好幸福 啊[馋嘴]！ ​​​,2014-1-12,1,['2435587595'],0,[],,0,[],
1179,@iFengshou农场 的玉米窝头，刚咬开，我说怎么没肉啊?结果我的嘴巴告诉我，它比有肉的都好吃[爱你]@木语潺潺 @--小石子儿 @点叠 我在:民生路 ​​​,2014-1-12,0,[],1,[],,9,"['579922049', '2435587595', '579922049', '579922049', '2281572877', '579922049', '2281572877']",:好吃[good]$[馋嘴]$:没猪油吗？$:是的，一点不腻。$:哦，是了，猪油配酸菜，好搭配，我就用猪油炒酸菜，没腥味。$:只有酸菜，好像还有猪油$它包的是啥妮？
1180,今天我们去亲戚家串门，他们的小孩比我家的大一个月，19个月，感冒咳嗽，每天打两针，先锋，说一感冒就得打，不打过不来，才多大的孩子啊，就用上了这么厉害的抗生素，我一阵叹息，无知啊，可怜啊，原来比我家孩子胖，高，现在反了。进入了有机行业，受益的不仅仅是嘴巴，还有生活方式，价值观，健康 ​​​,2014-1-12,2,"['1760200731', '2435587595']",9,"['1689273364', '1768964890', '1601828994', '1808930623', '1987505265', '723618994']",:是啊，有机不仅是生活方式，甚至是一种哲学，影响我们三观的哲学。学习和了解有机农业，也让我们学会与自然（包括病菌）如何相处。滥用抗生素的危害（以及避免常规养殖肉类中的抗生素）不必多说。不过真的遇到疾病，还是要咨询专业医生，不能走入另外一个极端。 $:是啊，有机不仅是生活方式，甚至是一种哲学，影响我们三观的哲学。学习和了解有机农业，也让我们学会与自然（包括病菌）如何相处。滥用抗生素的危害（以及避免常规养殖肉类中的抗生素）不必多说。不过真的遇到疾病，还是要咨询专业医生，不能走入另外一个极端。 $: 是啊，有机不仅是生活方式，甚至是一种哲学，影响我们三观的哲学。学习和了解有机农业，也让我们学会与自然（包括病菌）如何相处。滥用抗生素的危害（以及避免常规养殖肉类中的抗生素）不必多说。不过真的遇到疾病，还是要咨询专业医生，不能走入另外一个极端。 $:是啊，有机不仅是生活方式，甚至是一种哲学，影响我们三观的哲学。滥用抗生素的危害（以及避免常规养殖肉类中的抗生素）不必多说。不过真的遇到疾病，还是要咨询专业医生，不能走入另外一个极端。 $:是啊，有机不仅是生活方式，甚至是一种哲学，影响我们三观的哲学。学习和了解有机农业，也让我们学会与自然（包括病菌）如何相处。滥用抗生素的危害（以及避免常规养殖肉类中的抗生素）不必多说。不过真的遇到疾病，还是要咨询专业医生，不能走入另外一个极端。 $:是啊，有机不仅是生活方式，甚至是一种哲学，影响我们三观的哲学。学习和了解有机农业，也让我们学会与自然（包括病菌）如何相处。滥用抗生素的危害（以及避免常规养殖肉类中的抗生素）不必多说。不过真的遇到疾病，还是要咨询专业医生，不能走入另外一个极端。 ,7,"['579922049', '2642284752', '579922049', '601708348']",:不知道啊，也不知道是啥花$这花的根可以吃吗$:唉！[害羞]$为这条赞一个！这么深刻的理解力，做什么生意都能大成吧
1181,煤站已经加了一层高高的铁网，为了防止粉尘飘散吧!北京的北大门，已经为改善环境做了改变，希望你我生存的环境好起来。 我在:110国道 ​​​,2014-1-12,0,[],0,[],,0,[],
1182,@乐活塔拉 你们的羊有羊羔卖吗?我的亲戚想换品种，让我问问！ ​​​,2014-1-12,0,[],0,[],,0,[],
1183,本来不用唇膏的我，看到@宋俪文 的唇膏心动了，@柳树家的 玫瑰花在喝，再来个玫瑰味的唇膏，希望会变得像[鲜花]漂亮，嘻嘻嘻嘻… 我在:民生路 ​​​,2014-1-12,0,[],0,[],,4,"['579922049', '1698645815', '2170470811', '2385118305']",:是的$是小黄媳妇在发围脖吧？$[嘻嘻]最爱你家土豆，我认为只要多吃……每顿吃……就会漂亮[笑哈哈]$哈哈
1184,@山间别薯 的紫薯干果然名不虚传，好吃地想一口气吃完，我的土豆也做成这样的就好了。每次回来和农友交换美味的好吃滴，感到很幸福啊!@北京有机农夫市集 @青草山人姚继忠 @宋俪文 @iFengshou农场 我在:民生路 ​​​,2014-1-12,1,['1928714050'],3,"['1564258311', '1765052067']", 新店，详情稍后发布，敬请关注！ $ 新店，详情稍后发布，敬请关注！ ,6,"['2281572877', '579922049', '2281572877', '579922049', '2281572877']",:终于肯用油了[鼓掌]，别忘了放盐。看来你的石头片已失败$:不用了，等我试试刷油的那种烤法，做好了请你试吃啊$:我木有研究工具，要不我送你一袋薯片，还是你研吧。总不能彻底拒绝油炸吧，你知道有多少人回家炸粉咯吱去了。$:尽量不炸，要不送给你几斤你帮我研究研究，你吃过呀，我又没有吃过。$你还是做薯片吧，无有添加剂，或炸或烘都美味。我盼着呢[耶]
1185,抱歉，此微博已被作者删除。查看帮助：http://t.cn/Rfd3rQV,2014-1-11,0,[],0,[],,0,[],
1186,"《如何挑选好面包? 原汁原味, 回归自然就对了》常有人问, 我们家面包的口感,嚼劲很不一样. 秘密在哪里! 因为面粉? 做工不同????? 我总是同样一句话回答: 我们没有什么秘密, 就是让面包做它该做的事情而已。 当然我这句话, 不算是个真答案, 但这就点出本文重点...畅读版【http://t.cn/8FhHwv0】 ​​​",2014-1-11,0,[],0,[],,1,"['1822144781', '2703530915', '2405232143', '1274539005', '206060922', '1004770857', '579922049', '2435587595', '2735961743']",原理不懂，但知道是老板娘用心用力在做，每每吃的心服口服！$: 这个必须转，你家面包在嘴里嚼的时候味觉很丰富很立体，酸还是甜都有，还有$还没吃过你家的法棍$转发微博$ $: 这个必须转，你家面包在嘴里嚼的时候味觉很丰富很立体，酸还是甜都有，还有麦香。$ 你学习一下，下次见面给你一包杏仁，你做茶点哈！咱水村居茶会时用$: 杏仁可以的，最好是整个大杏仁稍微碾碎比较合适。杏仁片一旦打入面团，吃不出来了，而且容易烤糊。大杏仁也要先用热水烫皮才好，要不会有苦味。
1187,【开集通知】本周一集，1-11周六，11-16点，酒仙桥@颐堤港INDIGO 商场一层冬季花园！[心]不要搞错，这次重回高大上的冬季花园啦！[鼓掌]舒服明亮的赶集吧～年货丰富，各家还有实惠靠谱的“礼盒”，欢迎采购和预定。没有市集的日子，欢迎来@集室-农夫市集社区中心 补给，详见博客：【开集通知】1月11日周六，酒仙桥@颐堤港indigo 商场，各种年货走起咯 ​​​,2014-1-10,0,[],2,"['3043809382', '2810408502', '2805230272', '3044189334', '2790126442', '2789900132', '1757648637']",: 转发微博 $: 转发微博 $: 一楼的冬季花园就是感觉舒畅！[嘻嘻]有时间来吧，这次有很不错的陈酿！寒冬温酒多温暖。 $: 转发微博 $: 一楼的冬季花园就是感觉舒畅！[嘻嘻]有时间来吧，这次有很不错的陈酿！寒冬温酒多温暖。 $ $:今天去有机集市逛了一圈，规模不算大，品种也不算多。一些有机的果酱，奶酪，米酒还算是有点新意。价格那是相当的高大上，大白菜、萝卜等蔬菜10元一斤，草莓80元一斤。不知道这些有机菜的成本比非有机高多少，总之一般人真是不容易接受。 ,1,"['2306848001', '2497996700', '1854525740', '2306848001']",:一月二十五号二十六号啊$:谢谢回复。看到网评说你们的醉蟹非常好吃， 很希望尝一尝， 如果可以的话一定提前通知我一声哈。 谢谢啦！$ 去北京吧，时间可以
1188,晚上窗外的星星很多，陪我们还在处理有机大礼包订单，马上在讨论周六 @北京有机农夫市集 要准备的紫薯怎样才能不受冻！快乐辛苦的农场工作！[馋嘴][心] ​​​,2014-1-10,0,[],0,[],,0,[],
1189,特别报道，由于岳父在做粉咯吱时忘了一道工序，结果这周就没的卖了!实在对不起了!想吃的就先回味一下上周吃的吧![嘻嘻][嘻嘻] 我在这里:北京·兴寿 ​​​,2014-1-10,0,[],0,[],,0,[],
1190,我正在招聘生态农场员工，请大家帮忙转发 包头原生态农场招聘生态农场员工 ​​​,2014-1-10,0,[],5,"['2170698700', '3151895972', '2533958081', '1273076681', '1859544720', '2942274690', '3030481241', '1883400097', '2543530710']", 的产品。 $:支持一下 $:呵呵， 快来享受健康生活吧[哈哈] $:有志于农业的青年看过来！ $:转发微博 $:有志于农业的青年看过来！ $:有志于农业的青年看过来！ $:转发微博 $: 建立一种更有生命力的人际关系，引入中立平衡，协调利益。 ,0,[],
1191,10天了  喝飽能量水  的小麥草  長大了  可以打汁了  有誰知道  小麥草的功效？  獎勵 有機小麥一包！ 看誰的  行文 優美 細緻  引領我們 盡享  健康生活！[握手] ​​​,2014-1-10,0,[],0,[],,8,"['2584362822', '1986501573', '1850459044', '3212238390', '3212238390', '3212238390', '1226031530']",白开水还是最好的，这么多年听老人的都是这么生活过来的，都是经验啊，之前看好水世界上面也说，最好的饮品就是白开水.你有空也可以逛逛水世界的论坛$涨姿势了!$能普及一下怎样发小麦草吗$奖励有机小麦一包吧！$我的做法是将小麦苗洗干净后切碎放在搅拌机中加纯净水后打成浆，过滤后直接喝，不煮开是为了保存更多的维生素及其它营养成份。$小麦草可以抗癌，排毒，调便秘。我自已也种植，并且打汁喝，口感非常好。$:老農V5
1192,分享自青草  《我家的山核桃》 -   我家的山核桃丰收了  今年我要好好介绍一下我家的山核桃。因为这是我家核桃林在改变常规种植，采用有机种植方式后，第一次增产。增...  (来自 @头条博客) - 我家的山核桃  ​​​,2014-1-10,0,[],0,[],,0,[],
1193,@山间别薯 的厨房正在制作紫薯小猪，明天在 @颐堤港INDIGO @北京有机农夫市集 出现，[笑哈哈]一口一头猪，[得意地笑]小伙伴们猜一猜，后面的木头是干嘛的 ​​​,2014-1-10,0,[],0,[],,0,[],
1194,这款六边形鸡蛋包装盒就像一只橘子，骨碌一下子把“橘子皮”摊开，就变成了连着皮却瓣瓣分开的独立三角包装啦。每个三角纸盒里端坐着一只饱满的鸡蛋，很有档次吧。 ​​​,2014-1-10,0,[],0,[],,0,[],
1195,【开集通知】本周一集，1-11周六，11-16点，酒仙桥@颐堤港INDIGO 商场一层冬季花园！[心]不要搞错，这次重回高大上的冬季花园啦！[鼓掌]舒服明亮的赶集吧～年货丰富，各家还有实惠靠谱的“礼盒”，欢迎采购和预定。没有市集的日子，欢迎来@集室-农夫市集社区中心 补给，详见博客：【开集通知】1月11日周六，酒仙桥@颐堤港indigo 商场，各种年货走起咯 ​​​,2014-1-10,0,[],0,[],,0,[],
1196,喜大普奔！！我在@让红包飞 发起的#让红包飞#活动中抽到了支付宝钱包现金红包(1件)，2014年才刚开始，我就中了头彩！红包奖品超丰盛~名车、现金、艾派德等万种新春好礼统统0元送。快来抢个红包试试运气吧！马上抽奖：让红包飞 ​​​,2014-1-10,0,[],0,[],,0,[],
1197,冬天咳嗽怎么办 老中医推荐11个小偏方：1.白糖拌鸡蛋治疗咳嗽；2.木耳蒸鸭蛋；3.核桃、芝麻、生姜粉治疗咳嗽；4.梨汁炖冬菇治疗咳嗽；5.吃生姜片也止咳；6.煮萝卜水可治疗咳嗽；7.南瓜藤汁止咳；8.杏仁治疗咳嗽；9.搽风油精止咳平喘；10.罗汉果泡水治疗咳嗽；11.冰糖蒸白果。转。 ​​​,2014-1-10,1,['3182118392'],2,"['1420508580', '3182118392', '1854422147', '579922049']",: 我的办法是白萝卜切丁，几勺蜂蜜，4个小时候浸出水，兑温水喝，治疗有痰咳嗽，无论什么病，尽早发现尽早治疗，会好的快。 $:转发微博 $:我的办法是白萝卜切丁，几勺蜂蜜，4个小时候浸出水，兑温水喝，治疗有痰咳嗽，无论什么病，尽早发现尽早治疗，会好的快。 $:我的办法是白萝卜切丁，几勺蜂蜜，4个小时候浸出水，兑温水喝，治疗有痰咳嗽，无论什么病，尽早发现尽早治疗，会好的快。 ,2,['579922049'],我的办法是白萝卜切丁，几勺蜂蜜，4个小时候浸出水，兑温水喝，治疗有痰咳嗽，无论什么病，尽早发现尽早治疗，会好的快。
1198,昨天小段回村里了，拉进城2000斤柿饼，过年啦。给位亲准备些年货，也帮助村里人减轻负担，今天小段又要叫卖柿饼了，各位吃货，动动手指头宣传下，谢谢了：http://t.cn/8F7DimQ ​​​,2014-1-9,0,[],0,[],,1,"['2601885621', '3967733017', '1678485077']",: 电子商务改变了传统经营模式，让当地的优质土特产销售全国；也改变了当地农民的经济水平，让卖交通等条件限制的土特产迅速成了各大城市喜爱的商品。$批发价多少银子？$买过三次的人飘过[浮云]
1199,【农友档案】仙娘溪的南哥和他的砂糖桔： 仙娘溪的南哥和他的砂糖桔 文/饶琪弘 广东绿耕城乡互助社 南哥其人 认识南哥是在绿耕邀请了马来西亚的何赞能先生的生态农业的培训上。南哥很认真的做笔...文字版>> http://t.cn/8kdyNfM （新浪长微博>> http://t.cn/zOXAaic） ​​​,2014-1-9,0,[],1,"['1180735560', '579922049']", 把南哥的故事分享给大家。南哥今年砂糖桔量不大，主要供给广州本地市场，只给我们发了100斤，所以就放在集室销售。喜欢吃的朋友们快点去吧！ $ 你们也不除草吧！ ,1,"['579922049', '1497424340']", 你们也不除草吧！$今天买了些枯子，当时尝了一个，口味不错。
1200,家里的两种枣，大的是和田枣王，小的是@快乐返乡青年 家的。现在熬粥都用小枣，倒不是劣币驱逐良币，而是喜欢。小枣煮粥，煮好后，枣不会破，甜味都在枣里，粥是粥枣是枣。且枣皮很薄，我家那爷俩再也不用吐皮了。和田枣皮太厚，且煮粥枣必破，甜味渗到粥中，似甜非甜，家人不喜，适宜去核打浆或炖着吃 ​​​,2014-1-9,0,[],2,"['1798051983', '579922049']", $ ,1,"['2327881297', '2327881297', '2385658930', '2327881297', '579922049']",:谢谢推荐$:大枣是好东西。我现在犯懒，早上的粥都是电压力锅预约的，食材一起放入，调好时间，省事$我喜欢大枣，味道浓。我会头天晚上就泡它，煮水的时候先把枣放进去，这样就会吃到涨得鼓鼓的大枣[嘻嘻]$:枣肯定要经常吃，我们家一直是吃枣大户滴[哈哈]我也会放点水蒸着吃$ 
1201,背下此内容，你既是医生又是算命先生了！转给身边的朋友！！中国易经风水第一微博，关注我将会给你带来好运，[推荐]信风水推荐关注@中国易经风水 ​​​,2014-1-9,0,[],2,"['2737573290', '1904446973', '3679373784', '6295156939', '3837174037', '3878447935', '2246651643', '5075469240', '1116644691']",:转发微博 $:转发微博 $:有意思！ $:转发微博 $:转发微博 $:转发微博 $:转发微博 $:转发微博 $:转发微博。 ,0,[],
1202,俺家淘宝有优惠啦！[话筒]满百包邮（北京，天津，河北除承德张家口），其他地区（偏远地区除外）满百运费减半，还不快抓紧，快乐返乡青年生态农场 [圣诞树][圣诞帽] 祝大家圣诞快乐！ ​​​,2014-1-8,0,[],0,[],,0,[],
1203,多吃新鲜有机蔬菜 安全健康利己利人利环境 - 有机蔬菜是美食，更是良药。有机蔬菜中除了营养素之外，还含有许多的活性物质，这些活性物质，含量比较低，但功效很大。有机芦笋中的芦丁是治疗心血管疾病很好的药物；有机蕃茄中的蕃茄红素对前列腺癌有很重要的防治作用...  http://t.cn/8Fh29AU ​​​,2014-1-8,0,[],0,[],,0,[],
1204,#沃土云南之旅#云南鹤庆这几年天气有些异常，和屡次使用避雨弹打散云影响生态循环有关。不是干旱就是暴雨，冬天正是天竺葵插苗的最佳时间，但是当地山风吹得飞沙走石，别说劳作，沃土小编站都有点站不稳！这样极端的天气环境让种植生态天竺葵困难重重，好长时间都没有产出， 让返乡青年雪梅头痛不已。 ​​​,2014-1-8,0,[],0,[],,1,['1076230665'],雪梅[抱抱]
1205,抱歉，此微博已被作者删除。查看帮助：http://t.cn/Rfd3rQV,2014-1-8,0,[],2,[],,0,[],
1206,#让红包飞#新年的钟声是我的问候，新年的爆竹是我的祝福！这些还不够，在此为大家送上一个沉甸甸的大红包，愿大家在新的一年大吉大利！转发、评论这条微博就能领红包~万种高大上豪礼，统统免费送给你！@吾谷网 @罗小灵儿 @五道沟有机农场主168  马上抽奖：http://t.cn/8ka4t9y ​​​,2014-1-7,0,[],0,[],,0,[],
1207,年前快递也要提前休息的，大家抓紧这十几天的机会哦，快来囤点土豆吧，亚麻籽粉可是送给老人的绝好的。部分地区满百包邮活动持续到年底，详情请看：快乐返乡青年生态农场 ​​​,2014-1-7,0,[],0,[],,0,[],
1208,年前快递也要提前休息的，大家抓紧这十几天的机会哦，快来囤点土豆吧，亚麻籽粉可是送给老人的绝好的[礼物]。部分地区满百包邮活动持续到年底，详情请看：快乐返乡青年生态农场 ​​​,2014-1-7,0,[],0,[],,0,[],
1209,#我的早餐#炸酱面，自己家的猪肉，朋友自制黄酱，@沃翠源 的面条果然名不虚传，很劲道，好吃，好食材随便做做就好吃。 我在:公路街 ​​​,2014-1-7,0,[],0,[],,1,['2545218300'],美味十足啊！[bm可爱]爱自己，爱家人，爱健康，分享最原生态的农家美食，我粉你了，互粉下哦.
1210,想吃粉条的同学可以到@集室-农夫市集社区中心 购买哈！下次将出来紫薯土豆粉条。 ​​​,2014-1-6,0,[],0,[],,0,[],
1211,再来赶 @北京有机农夫市集 ，人比颐堤港多好多。。。不过买到了上次买到的 @山间别薯 的紫薯片 @快乐返乡青年 的粉咯吱。外加 @太平老農 的麻酱点心 ，南瓜馒头和全麦面包。 我在这里:http://t.cn/z8ARVxL ​​​,2014-1-6,0,[],0,[],,4,"['1650768054', '210102637']",:下回替你尝尝！$ 北京同学求关注[嘻嘻][爱你]
1212,【大凉山，那些吃土豆的孩子[悲伤]】当你抱怨饭菜不可口时，可知道，大凉山里有这样一些孩子：他们三餐基本上只有土豆。早上煮熟一锅土豆，放到一筐里，饿了就吃筐里的土豆。即使冬天，他们吃的也都是凉土豆......这样的孩子全国还有多少？我们能为他们做些什么？#温暖益起来#，转发，关注！(人民日报) ​​​,2014-1-6,0,[],0,[],,0,[],
