Num,Post,Date,Like,Like_ID,Share,Share_ID,Share_Content,Comment,Comment_ID,Comment_Content598,丰富的颜色勾起你的食欲：http://t.cn/RhYnCYx 淘宝销量第一的老品种红皮黄心土豆：http://t.cn/RhYnCYc 甜甜的杏仁，充分干燥，每一粒都是人工砸开，且吃且珍惜：http://t.cn/RhYnCYf 非常难得的老母鸡：http://t.cn/RhYnCYV 亚麻籽，亚麻籽粉，燕麦米加工中，马上就出来了，欢迎继续关注！ ​​​,2014-9-26,0,[],0,[],,0,[],
599,丰富的颜色勾起你的食欲：http://t.cn/RhYnCYx 淘宝销量第一的老品种红皮黄心土豆：http://t.cn/RhYnCYc 甜甜的杏仁，充分干燥，每一粒都是人工砸开，且吃且珍惜：http://t.cn/RhYnCYf 非常难得的老母鸡：http://t.cn/RhYnCYV 亚麻籽，亚麻籽粉，燕麦米加工中，马上就出来了，欢迎继续关注！ ​​​,2014-9-25,0,[],0,[],,0,[],
600,看看咱家的混合小土豆吧！多才多艺的煮妇把它们诠释得多么美丽，小朋友最喜欢啦，彩色土豆泥，土豆沙拉。。。。尽情发挥您的厨艺吧！http://t.cn/RhYGGti ​​​,2014-9-25,2,"['1241367691', '1279559105']",0,[],,0,[],
601,【10种适合女人睡前吃的食物】1.香蕉让肌肉放松；2.菊花茶凝神静气；3.温牛奶可以镇静安神；4.蜂蜜有助于睡前放松；5.土豆清除妨碍睡眠的化合物；6.燕麦片诱使产生褪黑素轻松助眠；7.杏仁催眠又能保护心脏；8.亚麻籽富含不饱和脂肪酸；9.全麦面包：睡前抗饿的最佳选择；10.火鸡：色氨酸的最好来源。 ​​​,2014-9-24,1,"['3256859590', '3255817870', '2368230605', '5210461752', '2210800392', '3858797552', '3256604541', '3539204775', '3607714805', '5271132521']",0,[],,2,['579922049'],[耶][威武][威武]咱家有一半呢！土豆，燕麦，杏仁，亚麻籽，全麦面也快有了，看来咱是为女性朋友服务的[给力][偷笑]
602,有机午餐：@快乐返乡青年 的红、紫土豆 + @小柳树农园 的豆角 + @小毛驴市民农园 的胡萝卜，购自@北京有机农夫市集 。张家口的高寒气候，加上返乡青年夫妇的悉心耕种，造就了他家土豆绵软细滑、令人叫绝的口感。在土豆原产地南美安地斯山那些披着厚厚织毯的印加人后裔种出来的土豆，应该就是这个味道吧 ​​​,2014-9-24,0,[],0,[],,0,[],
603,树上的枣没多少啦！这次的更大更脆，一年只有一次，不要错过呦！鲜枣/脆/甜 ​​​,2014-9-24,0,[],0,[],,0,[],
604,今晚在@集室 晚餐，自带@悟博苑 的油豆角，加上@快乐返乡青年 的白土豆（挑拣的货架上的残次品），做了一锅土豆焖豆角。第一次吃小黄家秋季新土豆，面面的口感已经很完美了。喜欢吃面土豆的亲，有空可以到@集室 购买，或者十一期间到@北京有机农夫市集 ，或者现在移步@快乐返乡青年 的淘宝店选购[呵呵] ​​​,2014-9-23,0,[],0,[],,0,[],
605,赶集回来，餐桌一下丰盛起来，农友互增的蔬菜，美味呀！@北京有机农夫市集 @iFengshou农场 一顿晚餐一扫路途的疲惫。 花园街 ​​​,2014-9-23,0,[],0,[],,8,"['1401745752', '579922049']",[兔子]$一直就有淀粉啊
606,小黑豆也是这么一把一把挑拣得来的，只为给大家好的品质。 花园街 ​​​,2014-9-23,1,['1322345720'],1,[],,5,"['715260125', '579922049', '1645964357', '579922049', '1274539005']",一样的床单$:不多的，以后多了可以考虑$成哥有机器，看看能否借用，如果你们豆子很多$:煮着吃，做豆浆，生豆芽都可以$小黑豆怎么吃
607,亲，有见过这么美的鸡肉横切面吗？味道就更不用说了。2-3年的鸡，需要慢慢炖才能咬得动呢！帮朋友卖的，知根知底，绝对放心，吃完这批就再没有了[泪]珍珠鸡/粮食喂养/3年鸡龄/顺丰包邮 ​​​,2014-9-23,0,[],0,[],,0,[],
608,树上的枣没多少啦！这次的更大更脆，一年只有一次，不要错过呦！鲜枣/脆/甜 ​​​,2014-9-23,0,[],0,[],,0,[],
609,2014新品甜杏仁，在家DIY杏仁露吧！营养又美味！2016新品/生态甜杏仁/人工去壳/味道浓郁/250g ​​​,2014-9-23,0,[],0,[],,0,[],
610,上周六只有试吃没有货可卖的甜杏仁上架啦！人工砸核，非常费时费力，大家且吃且珍惜吧！2016新品/生态甜杏仁/人工去壳/味道浓郁/250g ​​​,2014-9-22,0,[],0,[],,0,[],
611,今年的土豆丰收了个大，今天男青年回家起土豆女青年在家发货，这周市集就参加不了了。离三元桥近的可以去@集室 购买，如果想多几个品种就到我家淘宝吧。随时给您发货，北京隔天到。@北京有机农夫市集 ​​​,2014-9-22,0,[],0,[],,0,[],
612,中餐：土豆焖豆角、洋葱 胡萝卜炒彩椒、脆甜柿子@北京乐和仙谷有机庄园 的红苹果、有机稻米饭（这个忘拍了）。还是要说一下@快乐返乡青年 家的红皮土豆，内心是黄色的，口感是面乎的，超好吃!就这样，早餐午餐加起来近20样食材，五色五味搭配齐全  ​​​,2014-9-22,1,[],0,[],,0,[],
613,除了@慈心家园极品黑猪肉 的酱肉其余都是掌柜的作品@集室 @北京有机农夫市集 快给鼓励一下[嘻嘻]@快乐返乡青年 的土豆做了掌柜的最拿手的沙拉@顺义农户陈艳红 的糊子和@沃翠源 的全麦粉颗粒面粉混合再加上@圣林生态农庄 的虫虫蛋[馋嘴]掌柜的秘制糊塌子[鼓掌][鼓掌][鼓掌] ​​​,2014-9-21,0,[],0,[],,0,[],
614,有机午餐：@快乐返乡青年 的红、紫土豆 + @小柳树农园 的豆角 + @小毛驴市民农园 的胡萝卜，购自@北京有机农夫市集 。张家口的高寒气候，加上返乡青年夫妇的悉心耕种，造就了他家土豆绵软细滑、令人叫绝的口感。在土豆原产地南美安地斯山那些披着厚厚织毯的印加人后裔种出来的土豆，应该就是这个味道吧 ​​​,2014-9-21,1,['2295264641'],3,"['579922049', '579922049']",: 呵呵，有生之年去吃吃那里的土豆也不枉咱为土豆事业奉献一生了[哈哈]，谢谢鼓励，我们的任务就是种出优质的，让人叫绝的农产品，听到很多人都说：我就吃他家的土豆，他家的土豆最好吃了，云云，我们倍感骄傲，一定好好做下去，进 $:呵呵，有生之年去吃吃那里的土豆也不枉咱为土豆事业奉献一生了[哈哈]，谢谢鼓励，我们的任务就是种出优质的，让人叫绝的农产品，听到很多人都说：我就吃他家的土豆，他家的土豆最好吃了，云云，我们倍感骄傲，一定好好做下去，进一步提高自己的产品和服务[耶] ,4,['579922049'],呵呵，有生之年去吃吃那里的土豆也不枉咱为土豆事业奉献一生了[哈哈]，谢谢鼓励，我们的任务就是种出优质的，让人叫绝的农产品，听到很多人都说：我就吃他家的土豆，他家的土豆最好吃了，云云，我们倍感骄傲，一定好好做下去，进一步提高自己的产品和服务[耶]
615,赶集回来，餐桌一下丰盛起来，农友互增的蔬菜，美味呀！@北京有机农夫市集 @iFengshou农场 一顿晚餐一扫路途的疲惫。 花园街 ​​​,2014-9-21,4,"['3546798857', '5015360535', '2481190637']",7,"['579922049', '1401745752', '1401745752']",:农友们总是物物交换，温馨得很！志愿者们也能劳动换食材，大家互相帮助，没有金钱交易却各得所需，传说中的“团结经济”咩？ $:[兔子] $:转发微博 ,4,"['1401745752', '579922049']",[兔子]$一直就有淀粉啊
616,今年的土豆丰收了，而且口感非常好！明天是最后一天集市，下周我们就要停一周回去收获剩下的土豆。脆枣也没多少了，想吃明年吧!脆枣可以用酒做酒枣。味道非常香甜。今天卖到的觉对吃了说好！ 北京·兴寿 ​​​,2014-9-20,4,"['2235178793', '2168563671', '1930274804']",1,['1596858933'],:脆棗[good] ,2,"['579922049', '1899114491']",:差不多吧，回去又是紧张的收获节奏，尽快回来$枣好吃！下下周回来？
617,来了北京准备参加明天的市集，在德润屋落脚，吉总还是那么一丝不苟，为了配菜员给客人配了嫩的南瓜，给所有人开会，强调品质的重要性，德润屋能保持业界良好的口碑，正是缘于他的这种精神，和他接近的人都会被他感染。 北京·兴寿 ​​​,2014-9-19,3,"['1823229031', '3790681984']",0,[],,0,[],
618,【开集通知】9-20周六10-13点，崇文门@北京时尚新世界女子百货 地下一层[心]9-21周日10-14点，三元桥@华润凤凰汇 ，@集室 的门口。@良心梨 预定戳（手机微店）http://t.cn/RPiXhjo ，淘宝请搜索“良心梨” 。周日还有@桃花石生态庄园 的鲜枣。秋天真是收获的季节，下周的团购会是什么呢？一起期待吧 ​​​,2014-9-19,0,[],2,"['2036543795', '600307789', '1596858933', '3082403235', '2170470811']",:周六，周日的两场市集我都参加，如果有要吃鸡的电话 $:本周拙朴坊只参加周日三元桥市集，周六有事，就不参加了。 $ AG僅參加周六新世界女子百貨市集.秋冬保濕系列.手工皂.還有冬季最受全家人喜愛的天然植物護手霜.潤唇膏等秋冬護理產品全員到齊[呵呵] $:转发微博 $:柳树家只参加周六崇文门市集，会带上蓝莓鲜汁，蔓越莓鲜汁，蓝莓酱，蜂蜜玫瑰酱，金莲花，黄芩茶，玫瑰果。9月底我们的山货会增加一些，会有毛榛子、五味子、野玫瑰、蔓越莓果酱，期待[阳光] ,4,"['600307789', '2488224387', '2127192874', '1698972114', '1418375872']",本周拙朴坊只参加周日三元桥市集，周六有事，就不参加了。$这么多商家不参加周日的[泪]$请问集市是可以直接去吗？需要申请或者购买门票吗？第一次去不太了解$什么时候能再来卓展，离家好方便～$请问今天市集西兰花是哪家的啊？
619,这里就是俺家的枣枣，喜欢的亲要尽早啊!鲜枣/脆/甜 ​​​,2014-9-18,1,['2358311013'],0,[],,0,[],
620,已经在我家淘宝店铺预定紫薯的小伙伴，没有收到电子收据的请自行前往旺旺找客服索取。我们给您发送时，遇到的情况，有的没有加好友无法送达，有的离线消息已经满了的，部分没有发送成功。9月17日24点之前预定的小伙伴可以找客服索取。谢谢大家的支持和关注了！http://t.cn/RhoVaYS ​​​,2014-9-18,0,[],0,[],,0,[],
621,我发表了文章 那片枣树，那些枣子 ​​​,2014-9-18,2,"['2363545420', '2168563671']",0,[],,0,[],
622,这里就是俺家的枣枣，喜欢的亲要尽早啊!鲜枣/脆/甜 ​​​,2014-9-18,1,['2358311013'],0,[],,0,[],
623,这里就是俺家的枣枣，喜欢的亲要尽早啊!鲜枣/脆/甜 ​​​,2014-9-18,1,['2358311013'],1,"['579922049', '579922049', '579922049']", ，发不了货，拍下的延迟到下周一发，谢谢谅解。我们第一次带孩子去玩，好期待。 $: 周六日市集带些，去不了市集的可以移步淘宝啊！ $:周六日市集带些，去不了市集的可以移步淘宝啊！ ,14,"['579922049', '1503773982', '579922049', '1503773982']",:[呵呵]$:好的。谢谢。$:不用，现在处于休眠期，常温放半个月没问题，不要见光，风吹就好$放冰箱吗？可放多久？
624,土豆让您久等了，这周俩集我们都参加，久别的哥哥姐姐又见面了。带上今年大大的土豆@北京有机农夫市集 见。@柳树家的 @八晌田有机农庄 @三分地有机农场 @平人农场 ​​​,2014-9-18,0,[],0,[],,0,[],
625,这里就是俺家的枣枣，喜欢的亲要尽早啊!鲜枣/脆/甜 ​​​,2014-9-17,0,[],0,[],,0,[],
626,我发表了文章 那片枣树，那些枣子 ​​​,2014-9-17,0,[],0,[],,0,[],
627,四种土豆上架啦！让亲久等了，爱土豆的亲可以解馋了！快乐返乡青年生态农场 ​​​,2014-9-17,0,[],0,[],,0,[],
628,市集分享会开始。成都，西安，广州，南宁，上海，香港等地同行开始介绍他们在全国各地的工作。有的返乡务农，有的组织农夫市集，有的组织消费者团购，有经营餐厅，也有在ngo工作，用不同的方式参与健康农业。 ​​​,2014-9-17,0,[],0,[],,0,[],
629,唉！淘宝好久没有管理，土豆上不了架，明天好好研究研究。 ​​​,2014-9-16,0,[],0,[],,0,[],
630,下霜了，土豆秧子都死了，今天继续起土豆，红皮黄心的出来了[心][挤眼] ​​​,2014-9-15,0,[],2,[],,9,"['579922049', '2468611253', '233588234', '579922049', '2622398843', '579922049', '1367547771', '233588234']",:不是的亲，土豆本来就有很多种颜色$:难道不是转基因吗$:明早可[晕]$:有，但是现在还没有上架，过3天差不多$有淘宝店吗？$:河北张家口坝上，最低-1度今早$这有机土豆长的$什么地方、都下霜了？
631,红土豆和黑土豆今天收获了，只顾得拣土豆，没拍几张照片，男青年改装的梨很好用，一犁过去，土豆全出来了。大叔大婶们都是跪着向前走，我开始是站着蹲下站着蹲下得拣，后来腿疼得受不了，也跪着前进，好累啊，腿疼疼疼，以后有钱了换好机器。 246省道 ​​​,2014-9-14,4,"['2310018745', '5066844145', '5015360535', '1274539005']",1,['2342681583'],:稼穑艰辛几人知？ ,8,"['579922049', '2405867171', '579922049', '1645964357', '579922049', '579922049', '1645964357', '1274539005']",:谢谢理解[抱抱]$农民不容易啊$:用，一边扒拉土，一边拣，只是铲坏的少了，还有少量埋在土里$:男青年改装后的机器还需要人刨一遍吗？$:没事，谢谢[鬼脸二]$:土里面的都出来了，不用人刨，不用起第二遍$好机器可以减少哪些人工劳动？$好辛苦
632,这两天被各路同事好友去河边内蒙吃莜面的图刷屏刷烦了。中午来了顿莜面大餐：莜面鱼鱼，莜面窝窝，炒莜面[耶]炒莜面最好吃[花心]@快乐返乡青年 @一墩青 咱能好好种点莜麦，让我们吃上自己人种自己人做的莜面吗？@菠萝不兜 ​​​,2014-9-13,1,['2735961743'],0,[],,0,[],
633,深夜饿了。没有关系，有今天刚刨出来的@快乐返乡青年 家的土豆。为了对得起这些来之不易的土豆，找了五种香料和盐来搭配，还有波尔多的酒。 ​​​,2014-9-13,0,[],0,[],,0,[],
634,傍晚来到张家口市康保县道尹地村拜访 @快乐返乡青年 。八零后小两口黄利峰和李遇夏曾是大学同学，一起在北京工作，两年前决定携手回到坝上从事生态农业，现在专攻土豆、燕麦、小米和亚麻籽种植，通过@北京有机农夫市集 和市集上一些北京的农友在其配送中销售。见到这小两口，就感到农场名字之贴切。 ​​​,2014-9-12,1,"['3084332450', '3687382451', '2480868681', '1896050403', '1995267331', '2181299584', '2191389421', '1322608424']",0,[],,0,[],
635,考察小分队的到来，为我们带来了[下雨]，可是现在还是少下为好。时间仓促，没聊尽兴，还是很感谢每一位到访者，希望在大家的关心下产出更加优质的产品，让更多的人了解农产品的生产过程，生长环境@北京有机农夫市集 @上海农好农夫市集 @TALAYAYA 246省道 ​​​,2014-9-12,1,['2170470811'],2,['2266155834'],:转发微博 ,1,[],
636,#农场拜访#小分队晚上讨论到半夜十二点多，根本停不下来[偷笑]今儿个一大早六点多又起床，今天的任务是@一墩青 的石门口村，张北骆驼盘村两个基地和@快乐返乡青年 的康宝基地！出发！小分队[汽车] ​​​,2014-9-11,0,[],0,[],,0,[],
637,改装犁，做起土豆的准备工作[鼓掌] 246省道 ​​​,2014-9-10,2,"['2723607695', '2774674261']",0,[],,0,[],
638,很多人都在问，我们的土豆什么时间上市，搞得我们想快点把它们刨出来给大家吃，可是不行啊，要等到最低温零下2～3度时才能刨，现在要利用巨大昼夜温差，来积累淀粉，所以我们舍不得让它们早早出来，要把最优质，最香的土豆带给大家。再等等吧，亲，好饭不怕慢 246省道 ​​​,2014-9-10,6,"['1112347630', '2658361251', '2964523257', '1274539005', '5015360535', '1395904522']",9,"['2266155834', '2266155834', '600307789', '11924362', '600307789', '1657049701', '1026761082', '2951718202']",:好一个“好饭不怕慢”。面面沙沙又香喷喷的土豆，值得等待！ $:呵呵，雌性激素是西医的说法，中医讲究“阴阳表里寒热虚实”的辩证施治，看来这位中医先生喜欢跨界。事实上，蜂王浆含有微量的雌激素，蜂蜜中没有，这位喜欢跨界的中医有点不靠谱儿啊！[弱][哈哈][哈哈][哈哈] $:呵呵，雌性激素是西医的说法，中医讲究“阴阳表里寒热虚实”的辩证施治，看来这位中医先生喜欢跨界。事实上，蜂王浆含有微量的雌激素，蜂蜜中没有，这位喜欢跨界的中医有点不靠谱儿啊！[弱][哈哈][哈哈][哈哈] $:好一个“好饭不怕慢”。面面沙沙又香喷喷的土豆，值得等待！ $:好一个“好饭不怕慢”。面面沙沙又香喷喷的土豆，值得等待！ $: 好一个“好饭不怕慢”。面面沙沙又香喷喷的土豆，值得等待！ $:怪不得，前阵路过张北，在路边田里买了一包新刨的土豆，回来吃感觉不是特别面，看来还没到时候！[思考] $:好一个“好饭不怕慢”。面面沙沙又香喷喷的土豆，值得等待！ ,7,"['1026761082', '579922049', '1645964357', '579922049', '1645964357', '1407687135']",怪不得，前阵路过张北，在路边田里买了一包新刨的土豆，回来吃感觉不是特别面，看来还没到时候！[思考]$:本月20号左右吧！$:你们大概啥时再次回归市集？$:对啊！我们一直秉承品质第一$千万不要为了早上市而降低产品质量；只要东西好，即使上市晚，也会很受欢迎的$加油！
639,今天加入 @北京有机农夫市集 的农场采访团，一行八人驱车四小时来到河北张家口市怀安县第三堡乡南头百户村，拜访北有集农友 @一墩青 社区发展促进会，该协会帮助崇礼、张北、怀安三县的农民在这块贫瘠的土地上开展可持续农业，共有64户会员，协会培训会员，会员带动身边农户尝试有机种植。 ​​​,2014-9-10,0,[],0,[],,0,[],
640,趁还没有被推平，赶紧和我的小麦合影，听着风吹麦浪和机器的轰鸣，离品尝到它的味道不远了，饿了[馋嘴]，下次来地里就可以带自己的面粉做的馒头了[可爱][嘻嘻] 401县道 ​​​,2014-9-8,4,"['3687382451', '1645964357', '1374314751', '2339054407']",2,"['2729088183', '2170470811']",:这应该就是收获的季节，农人最快乐的时候 $:劳动一年，终于收获了[haha] ,15,"['579922049', '3687382451', '579922049', '579922049', '579922049', '579922049']",:给你尝尝不就知道了[嘻嘻]$坝上的麦子，昼夜温差大，品质应该比中原地区的好吧？$:是的啊，在用，但是需要时间$:这边都是这么少，气候不行，无霜期太短，地又太贫瘠$:我们这种不出玉米，来不及结棒子就冻死了$:产量亩产200～300斤，这儿的大田都差不多这个产量
641,务农之后，越发理解古人对自然的敬畏了，看这阳光下晾晒的谷子，150多个日夜的阳光雨露，稍有差池，都不会是现在这金灿灿的样子，一场风雨就可能让它们倒伏、发霉、变成黑色，尤其是收割前那几天，农民们就像接受了天谕，加班加点在阴雨之前收割了它们，晚一天这一年的收成就大打折扣了。 ​​​,2014-9-6,0,[],0,[],,0,[],
642,务农之后，越发理解古人对自然的敬畏了，看这阳光下晾晒的谷子，150多个日夜的阳光雨露，稍有差池，都不会是现在这金灿灿的样子，一场风雨就可能让它们倒伏、发霉、变成黑色，尤其是收割前那几天，农民们就像接受了天谕，加班加点在阴雨之前收割了它们，晚一天这一年的收成就大打折扣了。 ​​​,2014-9-6,0,[],8,"['2803186511', '579922049', '1920710314', '1763861637', '577229168', '579922049']",":农业的不确定因素太多了,每天都看天气预报,明天又有雨,今天一家人早上5点干到现在,中间就吃两顿饭,抢收就是这个节奏啊!所以,说有机产品贵的人,如果请你来种一年地,你的定价一定比我们更高. $:土豆比之前的都好吃，因为今年相对干旱，个头小，味道浓郁。 $: 农业的不确定因素太多了，每天都看天气预报，明天又有雨，今天一家人从早上5点干到现在，中间就吃了两顿饭，抢收就是这个节奏啊!所以，说有机产品贵的人，如果请你来种一年地，你的定价一定比我们更高。 $:敬佩真正用心做有机的人[good] $:农业的不确定因素太多了，每天都看天气预报，明天又有雨，今天一家人从早上5点干到现在，中间就吃了两顿饭，抢收就是这个节奏啊!所以，说有机产品贵的人，如果请你来种一年地，你的定价一定比我们更高。 $:农业的不确定因素太多了，每天都看天气预报，明天又有雨，今天一家人从早上5点干到现在，中间就吃了两顿饭，抢收就是这个节奏啊!所以，说有机产品贵的人，如果请你来种一年地，你的定价一定比我们更高。 ",12,"['2042272233', '577229168']",这种收获的心情想必是其他很多工作无法比拟的吧$:[太阳]小米都卖掉一半了。
643,百款超好吃的早餐做法，太全了！妈咪们学起！   ​​​,2014-9-1,0,[],5,"['2461860253', '2722616643', '3194436950', '2002154211', '1918650895', '2498856293', '2315896252', '2006584280', '2861493112', '3170782517']",:转发微博 $: 转发微博 $:转发微博 $:转发微博 $:转发微博 $:儿童早餐  $:转发微博 $:转发微博 $:转发微博 $:转发微博 ,0,[],
644,瞧这些奇形怪状的土豆，都是纯天然的哦 ​​​,2014-9-1,0,[],0,[],,4,"['1787082355', '1664224465', '5033562366']",不都是人工选育出来的，说不定还是转基因的$很好吃$土豆也有非天然的？
645,抱歉，此微博已被作者删除。查看帮助：http://t.cn/Rfd3rQV,2014-9-1,0,[],3,[],,0,[],
646,【田野调查】转发一个农友的微信：“又下雨了，眼睁睁的看着谷子烂在田里，辛苦了一年，快到口的食就这样没了……农民，中国最弱的群体，还要无奈的抵抗着天灾……”接着又发一条“今年下半年雨量集中，好多稻子都倒了。希望老天不要再下雨，等我们把谷子收完，努力把灾害降到最低” @顾秀林的微博 ​​​,2014-8-31,0,[],1,"['2930669524', '577330490', '579922049', '2312158865', '2755160401', '170513943', '1807543674', '1855231510']",: 转发微博 $: 不做农民不知道其中的心酸，农民要承受各种天灾，还要承受市场经济下价格的波动，真是生活在水深火热中。不种地不知道啊，每一粒粮食都来之不易，从种到收，无时无刻不需要老天的关照。所以，请珍惜。 $:不做农民不知道其中的心酸，农民要承受各种天灾，还要承受市场经济下价格的波动，真是生活在水深火热中。不种地不知道啊，每一粒粮食都来之不易，从种到收，无时无刻不需要老天的关照。所以，请珍惜。 $: 昨夜风雨骤来，今晨稻谷倒伏。明朝煮饭下锅米，灌浆尚未饱满... $:昨夜风雨骤来，今晨稻谷倒伏。明朝煮饭下锅米，灌浆尚未饱满... $:昨夜风雨骤来，今晨稻谷倒伏。明朝煮饭下锅米，灌浆尚未饱满... $:昨夜风雨骤来，今晨稻谷倒伏。明朝煮饭下锅米，灌浆尚未饱满... $: 昨夜风雨骤来，今晨稻谷倒伏。明朝煮饭下锅米，灌浆尚未饱满... ,0,[],
647,在乡下，孩子可以自由得奔跑。傍晚的草原，像油画一样的色调。 246省道 ​​​,2014-8-29,4,"['1866098122', '1081522681', '1883461250', '2435587595']",0,[],,8,"['579922049', '579922049', '579922049', '579922049', '1418912754']",:好好，欢迎$:唉，市集的都不来了，您可以单独来玩啊！$:[可爱]是的，很美，夏天来这玩吧！$:好啊，欢迎欢迎$真美，让人羡慕。
648,这不是嘛！趁着微风，开始扬场了，农人，总不放太阳的恩赐，有[太阳]，就干个不停[威武] 246省道 ​​​,2014-8-29,3,"['2166090860', '2235178793', '2435587595']",0,[],,0,[],
649,燕麦也收获了，不赶巧的是前天晚上开始下雨，燕麦被水泡湿，今天出太阳了，赶紧晒晒，等风刮起来就可以扬场了。 ​​​,2014-8-29,0,[],0,[],,2,"['579922049', '5015360535']",:还得等等，下月差不多$啥时候在淘宝能买到这个？
650,小麦收获了，收成不错呢，今年是收小麦的年，我们的面包车运了3回，真给力啊！男青年也很给力，全是他搬的，明天还要再搬两次。 246省道 ​​​,2014-8-27,2,"['2435587595', '2723607695']",0,[],,2,"['579922049', '1274539005']",:我们这冷，春天种，秋天收，一年只能种一季，每亩只有200斤左右的产量。$现在才收麦子啊
