Num,Post,Date,Like,Like_ID,Share,Share_ID,Share_Content,Comment,Comment_ID,Comment_Content1721,一直没有下雨，土豆干旱至极，准备浇水，听人说，浇了水土豆种子会烂，不免有些担忧。我们这禁牧了，人们晚上偷偷放羊，还有人专门把羊赶进人们地里吃庄稼，原打算收获前一个月去地里住，现在看来，整个夏天都要住了，自己住不了就雇人。什么时候粮食收到家里，才算真正的放心了。 ​​​,2013-5-30,0,[],0,[],,10,"['579922049', '2143204075', '579922049', '2143204075', '579922049', '2170470811', '579922049', '1866061970', '579922049', '2435587595']",:良心做事，必有福报，谢谢你这样知心的消费者，你们的理解和支持是我们的动力来源之一。$:嗯，做良心事，必然辛苦，不辛苦可以选择昧良心，这是做人的态度。敬佩你们这些良心事世的人。好的事情一开始虽有疑惑不解，但日久见人心，时长现结果，我虽不能亲身种植，但能参与消费，也很欣喜。加油哦。$:理解万岁，不管做什么事，都有困难，我们会克服的，做农业要经得起考验呢!$辛苦啊，享受你们辛勤劳作的成果我心存感激。有机食品虽然价高，但物有所值，也更珍惜。$:抓住了狠狠罚他款$哇！！怎么是这样呢，难受只能承受。老天呀，给我们来点雨吧！还有吃庄稼这种事一定要严惩，合伙收拾他[怒]$:对，应该没事，天天刮风，沙土渗得快，存不住水。$土豆浇水浇到抓一把土攥一下能出形状就差不多了，好像是。$:应该给的，但是没给，他们舍得给吗?早装自己腰包了，不给补贴，所以人们才可以偷偷放，小地方的官员胆子更大，更黑。$我的天！怎么是这样的？禁牧，政府不给农户补贴吗？如何生活呢？
1722,#永年一9岁女童走失# [心]【家人急寻线索】走失女孩名叫李雯旋，今年9岁，家住永年县刘营乡后瓜井村。李雯旋离开家时，上身穿绿色短衫，下身穿白花裤子，脚穿小红凉鞋，“孩子说话不太清楚，但挺聪明”。有知情者请与李先生联系。电话：15544799919。 ​​​,2013-5-29,0,[],0,[],,0,[],
1723,#永年一9岁女童走失# [心]【家人急寻线索】走失女孩名叫李雯旋，今年9岁，家住永年县刘营乡后瓜井村。李雯旋离开家时，上身穿绿色短衫，下身穿白花裤子，脚穿小红凉鞋，“孩子说话不太清楚，但挺聪明”。有知情者请与李先生联系。电话：15544799919。 ​​​,2013-5-29,0,[],2,"['2038527001', '3043763252', '1560977461', '3045013312', '3045084170', '2347297653']",:转发微博 $: 转发微博 $: 转发微博 $:转发微博 $: 转发微博 $:转发微博 ,0,[],
1724,我们这不仅风大而且干旱，刚昨天移栽的西红柿今天就这样了!@八晌田有机农庄 你们那不管怎样还有点雨，多幸福啊!@--小石子儿 我在:015乡道 ​​​,2013-5-29,0,[],0,[],,1,['2435587595'],继续为你和农户祈雨。
1725,这儿气候寒冷，赏花植物为数不多，能见到这么漂亮的花，实在是激动啊!@千山莲子 ​​​,2013-5-29,0,[],0,[],,7,"['1631746661', '579922049', '1631746661', '579922049', '1631746661', '2435587595', '2135728917']",:不是有一种调料叫丁香嘛。。。味道蛮奇怪的$:丁香可以吃，还不知道呢!$:和做饭的那个丁香有关系咩？$:丁香[爱你]$什么花？$丁香，你那里的春天刚开始，不要着急------休息一下[嘻嘻]$这是什么花？我似乎没见过。
1726,把南方的雨分给我们点吧!我们这要旱死了。土豆明天开始喷灌。@--小石子儿 @6里地健康生活馆 @陈统奎 我在:015乡道 ​​​,2013-5-28,0,[],0,[],,6,"['579922049', '579922049', '2135728917', '579922049', '2135728917', '2435587595']",":我那天写错了，把乡写成县了。呵呵!什么时候回康保来吧!$:我是道尹地的，你们二号卜子总出能人。太厉害了!$:康保就是县啊亲,哈哈,二号卜的!$:你是康保哪个县的？$我的老家也是康保啊$我为你祈雨。"
1727,生活中获得幸福的方法人人期盼，其实最简单的方法就是知足，“事到知足心常乐，人到无求品自高”。欲望永远无有止境，少欲知足常生欢喜。高楼大厦带不来内心的安定，功名利禄也掩盖不住内心的惶恐，放下一切的贪着，惟有炼心的修行才是人生路上最幸运的追求和最幸福的时刻。 ​​​,2013-5-26,0,[],1,"['3108673767', '1280453171', '3213401137', '3213401137', '1881477995', '513719567', '2276897882', '2711472372']",:转发微博 $:转发微博 $: 转发微博 $: 转发微博 $:转发微博 $:转发微博 $:转发微博 $:转发微博 ,1,"['206801243', '1142559505', '1699493885', '2413734693', '2740987957', '2673020417', '2456272071', '1899668611']",高楼大厦带不来内心的安定，功名利禄也掩盖不住内心的惶恐。知足常乐。$: 转发微博$:欲望永远无有止境，少欲知足常生欢喜。放下一切的贪着，惟有炼心的修行才是人生路上最幸运的追求和最幸福的时刻。$:欲望永远无有止境，少欲知足常生欢喜。放下一切的贪着，惟有炼心的修行才是人生路上最幸运的追求和最幸福的时刻。$事到知足心常乐，人到无求品自高。[赞]$ཨོཾ་ཨཱཿཧཱུྃ༔བཛྲ་གུ་རུ་པདྨ་སིདྡྷི་ཧཱུྃ༔ བླ་མ་མཁྱེན་ནོ།[祈祷]$顶礼嘉样堪布！[蜡烛][蜡烛]$转发微博
1728,#@懒人业余餐厅郎园店 装修进行时# 还没开张，@北京有机农夫市集 菜市场就开到门口了...可是鸡呢？[偷笑]这活动必须经常搞。@齐大福 @荒岛chou-chou @米酒先生 @乐活村-乐活先生 @夏夏inBJ @会飞的毛毛毛毛虫 @郎园vintage @黄天space ​​​,2013-5-25,0,[],0,[],,0,[],
1729,【最有良心的话】袁隆平：“国家每年拿上亿的钱来补贴石油企业更不合理。石油那么贵，都是高价、高利润垄断企业，做石油的人都是有钱人，都是开小车的人，哪里还需要国家的补助呢？国家补贴他们干什么？为什么不拿这个钱来补贴农民呢？农民辛辛苦苦种一亩地得了100块钱，就是有钱人的两包烟钱。转 ​​​,2013-5-25,0,[],0,[],,0,[],
1730,明天去看看蜜蜂族群，第一次和它们亲密接触。 ​​​,2013-5-25,0,[],0,[],,0,[],
1731,一直在给孩子用纸尿裤，纸尿垫，忽然发现，对环境太不友好了，决定不用了，让他直接尿在小褥子上，白天晒干，经济又环保。 我在:015乡道 ​​​,2013-5-25,0,[],2,['1289686364'],:转发微博 ,3,"['579922049', '2435587595']",:[可爱]我买了可以重复利用的尿垫。$女士用卫生巾都会有感觉，孩子的纸尿垫太不舒服了！
1732,#随手拍#吃过纯净新鲜蓝莓么？除现场采摘谁敢说没有不加添加剂的，#蓝莓庄园#是世界wwoof有机农庄组织成员，全程透明义工旅行见证原生态无添加剂；自营农场无中间环节；全国顺丰包邮当天递到。购买前关注@蓝莓daniel 转发此条@三个以上好友，即9折！转发有1个购买即送一盒礼券 ​​​,2013-5-24,0,[],1,"['2039930885', '1052182383', '1838793773', '1838793773']",:蓝莓睇季节快到了 1.5元一磅 我要和你一起吃 现在你 快睡觉 熬夜啊又？我们会有一天在一起得 我拥有最美好睇回忆[心] $ $ $ ,8,"['2239695565', '3270467667', '3149884193', '3318100971']", $[心][赞][鼓掌]$ 【300元三斤】 $魔鬼中的天使111
1733,土豆归来 北京回来种土豆，土豆品种多又好。 土豆做熟面又香，香味飘到北京去。 市集卖了都说好，上帝夸咱数第一。 我在:015乡道 ​​​,2013-5-23,0,[],0,[],,4,"['1631746661', '2435587595', '2143204075', '2339150094']",放着我来！$[哈哈]$嘿，嘿，数，第，一。真有才。$ 
1734,大米，大米，土豆呼叫大米。@八晌田有机农庄 你的稻秧插完没有！我正在挖窖，秋天收获得土豆就可以储存了。@北京有机农夫市集 @齐大福 @6里地健康生活馆 ​​​,2013-5-23,0,[],0,[],,0,[],
1735,地里活忙的时候，勤快的人会摊七八百张煎饼来作为“工作餐”。自家的食材，柴火。小窝棚里的温度足以让你瞬间桑拿。比较起来@齐大福 在@北京有机农夫市集 上的工作环境简直就超五星级啊！[偷笑] 据说这样的煎饼可以存放一夏天！不过我手中的这张刚出鏊(ao)子的都没超过三分钟[哈哈] ​​​,2013-5-23,1,"['2273285473', '2735961743']",1,"['1166925472', '1872225834', '579922049', '1598032402']", 咱什么时候也搞个春耕节嘛！ $ 咱什么时候也搞个春耕节嘛！ $ 咱什么时候也搞个春耕节嘛！ $:看着很不错哟！[馋嘴] ,0,[],
1736,【学校不安全，女生集体在寝室被轮奸】萧县黄口中学，5.12凌晨有五名 开运动会高一女生没回去，凌晨 一点遭一群社会人在社会强奸，还有一名女生下落不明，宿舍管理员听到 声音竟然不闻不问.现如今学校又要封 锁此事，让其校学生删除说说和贴吧 的有关内容，说是对学校影响不好． http://t.cn/zHzyPuu ​​​,2013-5-19,0,[],1,"['3174229685', '1939306483', '2981657255', '2178707810', '317963555']", $ $:转发微博 $:有关部门请辟谣! $: 真的假的？ ,4,"['1677888740', '3174229685', '317730007', '1423675293', '2073475194', '2951579683', '2951579683', '2647593177']", $ $ $刚才路过小学，门口接孩子的家长比以往多了，有点小拥挤。$首先化学阉割人渣。。然后这就是天朝。。社会主义社会。啧啧啧笑而不语$ $转发微博$:操，我们学校，把那帮人杀了!
1737,大家注意吃土豆的好处！@--小石子儿 @6里地健康生活馆 @教钢琴的农民 ​​​,2013-5-19,0,[],0,[],,1,['2435587595'],[嘻嘻]
1738,从昨天傍晚开始沙尘暴，现在还在继续，风力8、9级，啥也干不成啦，种子埋在地里，不下雨不说，还给刮大风吹干，求雨[下雨][下雨]@--小石子儿 北京天气咋样？ 我在:015乡道 ​​​,2013-5-19,0,[],0,[],,1,['2435587595'],刮了一天的大风，飞沙天气！
1739,开业一月，我们粉丝超过了750个，多名粉丝晒单圈我们，而且——企业认证蓝V标志也亮起来了！太高兴了啊~为了让亲们也感同身受，邀请您参加#庆开业一月##庆蓝V点亮抽奖#活动，即日起至5月19日24:00，共抽10名亲粉各送礼包一个！条件1、关注@6里地健康生活馆 2、转发本微博. 来吧，一起翻滚吧~ ​​​,2013-5-18,0,[],0,[],,0,[],
1740,这种馅的莜面大饺子，土豆女青年还是头一回吃，吃了8个那，再也瘦不成以前的身材了，怎么办呀?[泪] ​​​,2013-5-18,0,[],1,[],,11,"['579922049', '2435587595', '579922049', '2435587595', '1631746661', '1208022195', '579922049', '1208022195', '579922049', '1208022195']",:呵呵!你来就知道了。$:夏天可以吃的岂不是更多！$:夏天苦菜就老了，现在吃正好。$[嘻嘻]夏天去你家锄草时我也能吃上了$胖也值了！！啥时候能吃着！$:秋天带到市集上卖啊，新鲜食物大家必定有兴趣。$:你来我家，请你吃，我们今年收获了莜麦，会试着做莜面窝窝等，可是我现在还没有学会。[汗]$:你们吃的都是我原先都没听过的组合和搭配$:我分析了一下，我们这食物种类少，吃啥都香。$太馋人了也[抓狂]
1741,今天上午把小红豆种了地就种完了，下午和妻子挖了点野菜（苦菜）回来。妈妈把苦菜和土豆丝拌起来做了苦菜大饺，不过饺子面是莜麦面做的。香哪！@--小石子儿 @6里地健康生活馆 @阿恐 @余地农庄 我在:246省道 ​​​,2013-5-18,0,[],1,['522411567'],:哈哈…… ,6,"['522411567', '1631746661', '1208022195', '2435587595', '3233568400', '2435587595']",哈哈……$成品长啥样？$这吃饭新鲜。[威武]$乐活村的羊圈离你家很近哎！哈哈，我在草原总算找到熟人喽~$想莜麦了！$看起来好馋！你在坝上，和北京吃的东西差别挺大的，上回那个土豆和荞麦粉混和做的东西，我真是第一次见呢[威武]
1742,《社会现象根源》：1.仇的不是富，是不仁。2.恨的不是官，是贪腐。3.愤的不是穷，是不公。4.怒的不是房，是奸商。5.怕的不是警，是枉法。6.愁的不是钱，是通胀。7.基本国情：穷人的孩子早当妈，富裕的孩子早当爸。8.全国学子两件事：混日子等考公务员，考上公务员混日子。(来自微信）  ​​​,2013-5-18,0,[],0,[],,0,[],
1743,今天我开车老爸还是指挥种了6亩亚麻，我们准备给大家做亚麻粉和亚麻油，亚麻冷榨营养更丰富。@6里地健康生活馆 @北京有机农夫市集 我在:246省道 ​​​,2013-5-17,0,[],0,[],,13,"['579922049', '579922049', '2435587595', '2170470811', '2735961743', '579922049', '579922049', '2735961743', '579922049', '579922049']",:可怜的鹏哥呀!我们也挺忙，趁年轻多干点吧!$:会的。$:开花时节拍照片吧，没见过好像$:我是柳树，金鹏天天采野菜，焯野菜，哈哈，忙的要死。$ 的农商户有更进一步地交流[鼓掌][鼓掌][懒得理你]$:金鹏干什么呢?$:和土豆差不多，没事，我会给你留下。大概要多少？$:何时能收成呢？我们一款挺受欢迎的亚麻籽土司主角呢[心]$:多谢多谢！$:是的，它的吃法很多，花也漂亮。
1744,挖苦菜时发现了好大的一个红蜘蛛，他也在找吃的哈！ 我在:246省道 ​​​,2013-5-17,0,[],0,[],,6,"['579922049', '1631746661', '579922049', '1631746661', '579922049']",:这么晚了，你快睡吧!熬夜也会发胖的。哈哈[哈哈][哈哈]$:我又没把它当煮熟的螃蟹！$:妹子这个不能吃。$好小$:没有，坝上耐寒动物。
1745,经过了半年多的冬天，这里终于迎来了美丽的春，温暖的季节很短暂，所以倍加珍惜。[微风][微风][微风] 我在:246省道 ​​​,2013-5-17,0,[],0,[],,4,"['2540693417', '579922049', '2170470811', '2039428497']",[赞啊]$:你们那才是物产丰富的好地方啊。$好地方!$[鼓掌]
1746,看看这是干啥用的？好像电视剧里某个历史人物的兵器。[哈哈] 我在:015乡道 ​​​,2013-5-17,0,[],0,[],,6,"['1445312620', '579922049', '579922049', '1445312620', '1445312620', '1631746661']",:长见识了，谢谢你。$:是播种机后面盖种子用的。我们叫“滚蛋子”。$:这个东西我们这叫“滚蛋子”，是播种机后面盖种子用的。$真猜不出来$这是什么啊? 新型灌溉用的?$蹦爆米花？
1747,【G4出动】昨晚10点几，从化仙溪村落咗场大暴雨，然后就发大水。G4记者喺现场见到，大片房屋被冲毁，好多车、电线电缆都被冲倒，一片狼藉。据村民话，至少有3个人确认已经遇难。广州新闻频道19：00首播嘅《新闻日日睇》，会同大家详细讲下仙溪村嘅受灾情况，敬请留意！ ​​​,2013-5-17,0,[],0,[],,0,[],
1748,唉哟喂，一其以为覆盆子就是野草莓区别大着呢。左边即覆盆子，个小微酸果实饱满结实，口感层次丰富，长在树上。右也野草莓俗称地泡，果实松软生长在路边田头的草丛中，果实地部没有叶子有个空心的泡只有淡淡的甜味是鲜红色。长知识了 ​​​,2013-5-17,0,[],0,[],,0,[],
1749,最后一批红土豆种植中！地太硬犁尖都弯了。@北京有机农夫市集 @马云123 @6里地健康生活馆 ​​​,2013-5-16,0,[],0,[],,15,"['1866061970', '579922049', '2435587595', '579922049', '1866061970', '1866061970', '579922049', '2435587595', '1866061970', '579922049']",:呵呵，谢谢，希望我们有合作的机会。$:是的，有机市场现在还不成熟，希望你能做的更好。$:[泪]我也这么认为！坚信这点！$:我和孩儿他妈都是一个想法，种植量跟着市场需求，稳住脚步踏实的走。不能贪太多，做什么都要有个量，不能光为了钱而大干特干，这样活的太俗气。自己活着快乐，多认识些像你一样的好人我们这辈子就算没白活。在我们眼里钱是个变化的数字，唯有亲情，友情才是永恒的。$:都是搞农业的，一起加油啦，你们做有机土豆我挺佩服的，我们不敢做有机的，一是产量不高，二是不好推广，单独做市场挺费劲。呵呵$:都是搞农业的，一起加油啦，你们做有机土豆我挺佩服的，我们不敢做有机的，一是产量不高，二是不好推广，单独做市场挺费劲。呵呵$:呵呵，你太厉害了![good]我的胆子小，不敢贪那么多，每年够一家老小开销就行。$资金易得，信用难求。$:嗯，钱是个问题，我家农场今年光买机器就花了一百多万。我看你那块地也挺大的，如果你认为你的发展模式不错的话，可以忽悠朋友们投资，呵呵$:你在天津不方便吧!
1750,天气回暖，第二批土豆将在明天开始种。最后这批是红皮土豆老品种生长期短，据说好吃！@北京有机农夫市集 @6里地健康生活馆 @马云123 我在:015乡道 ​​​,2013-5-15,0,[],2,['345913968'],辛苦了！ ,6,"['579922049', '579922049']",:9月中下旬，呵呵!我们一块儿慢慢等吧!$:头像里只有四个品种，今年我们有五个。
1751,燕麦，又名雀麦、铃铛麦。富含淀粉、蛋白质、脂肪、B族维生素、尼克酸、叶酸、泛酸、钙、铁等营养成分，具有益肝和胃、养颜护肤等功效。美国《时代周刊》评出的十大健康食品中，燕麦名列第五。 ​​​,2013-5-15,0,[],0,[],,10,[],
1752,"@快乐返乡青年 之前拍的芒果花！团抱而生,小小花瓣~白中透黄~ ​​​",2013-5-15,0,[],1,"['3071760372', '579922049']",:想象不到，这么平凡的小花会变成好吃的芒果，谢谢你的芒果花照片[心][握手]。 $:想象不到，这么平凡的小花会变成好吃的芒果，谢谢你的芒果花照片[心][握手]。 ,8,['579922049'],想象不到，这么平凡的小花会变成好吃的芒果，谢谢你的芒果花照片[心][握手]。
1753,我写的《一位过来人对城镇化速度的担忧》全文，欢迎大家批评指正。 ​​​,2013-5-15,0,[],0,[],,0,[],
1754,今天终于在老爸的指挥下种下了燕麦，我家的播种机太给力了，一个来回就是一亩。今天估计种了有30多亩。大家尽情等待吧!@--小石子儿 @6里地健康生活馆 @北京有机农夫市集 ​​​,2013-5-14,1,['1238724731'],4,"['1872225834', '1586294641']",:[鼓掌] $:转发微博 ,17,"['579922049', '579922049', '1631746661', '579922049', '1631746661', '579922049', '579922049', '579922049', '579922049', '2339150094']",:你们年轻人总整些新名词！[哈哈]$:是啊，可是这里也就适合种这些。$:就是拉风！$:什么意思？$好拉轰的车！$:有时间来我这玩吧!$:对，最多每亩200斤。$ 给予的帮助，欢迎来玩！$:过奖！$莜面产量低
1755,快睡觉了，发个围脖与大家分享。作为农场也好，作坊还是其他商户也好，既然大家都开了微博，说明也需要这种方式与每个人交流，但是有些农场却在看人，对于对自己无用的问题根本不理，更谈不上回复。希望大家不要这样，对于给各种评论或提问的回复，是一种最起码的尊重。 我在:015乡道 ​​​,2013-5-13,0,[],3,"['1445312620', '3071760372']",:我曾经也遇到这类问题，本来就是个探索互相学习的过程，好的经验拿出来分享不是更好？ $:微博，是一个互动的平台！要学会认真面对每位粉丝的关注，认真对待每一条转发与评论！ ,9,"['579922049', '1445312620', '579922049', '579922049', '579922049', '2170470811', '1189494880', '2921646911']",:是的，微博是交流的平台不分贵贱，富有和贫穷。都有发言的权力！$我曾经也遇到这类问题，本来就是个探索互相学习的过程，好的经验拿出来分享不是更好？$:不敢不敢，有时候我也是挺坏的。[嘻嘻][嘻嘻]$:大家一起等，[呵呵][呵呵]$:呵呵，是的。不回复损失的是自己。$是啊，尊重……不过有些农场不像咱们一样是自己管理，我和金鹏两人轮着看，就出现过很多次忘回复的情况，比较严重的是私信都没回[汗]$等着吃你种的土豆[嘻嘻]$你人真是好，你真是好人！
1756,【济南拟禁止城镇居民经营家庭农场】近日，山东省济南市出台文件，鼓励引导大学生、外出务工农民等投资创办家庭农场，但是禁止城镇居民经营家庭农场。http://t.cn/zTulWMA如果出现农村居民登记家庭农场后，由城镇居民经营，这样的家庭农场将被“摘牌”。 ​​​,2013-5-13,0,[],2,"['3260040181', '3272720067', '579922049', '234517246', '876545686', '2671583245', '2719811321']",:转发微博 $:转发微博 $:转发微博 $:转发微博 $:犀利！[赞][威武]是否注册与品质沒有任何关系，部分涉农者盯的不是品质，不是市场，是天天研究农业新政策，忙手续，要补贴，在干品质和销售之外的活。不是不该做手续，而是别成了专门跑政策补贴。 $:犀利！[赞][威武]是否注册与品质沒有任何关系，部分涉农者盯的不是品质，不是市场，是天天研究农业新政策，忙手续，要补贴，在干品质和销售之外的活。不是不该做手续，而是别成了专门跑政策补贴。 $ 微话题 ,1,"['535677932', '610370177', '538319012', '1602684174']",那要“非转农”？$:哈哈哈$好$好！防止资本家吞并土地。[赞]
1757,卖花姑娘[嘻嘻]在@北京有机农夫市集 帮忙，因为是母亲节，@三分地 特意摘了菜心儿花儿扎了小花束送给妈妈们，灰常的春天！灰常美丽！ ​​​,2013-5-13,0,[],0,[],,0,[],
1758,我坚信，把北京做城市绿化的地方全都种上菜和果树，足够给这个城市的人们吃。那些草坪，是很耗水的植物，把它们都变成菜地，由生态农业的专业人士做指导，每块地由就近的单位认养认种，人人参与劳动，用最符合生态自然的方法种植，会彻底改变这个城市人们的生活，从饮食到衣着，到价值观、审美观。 ​​​,2013-5-13,0,[],1,"['1752952790', '2166983133', '279911907', '1876819641', '1401745752']",: 社区菜园就很实际啊，已经有实例的，马路边汽车尾气污染太厉害了，好多绿化树种都可以吸附污染物，绿化树木起到了净化空气的作用呢! $:想法很好，但那地长出来的东西可能会毒死人 $:[赞]这想法好，可持续！ $: 不见得全种菜和果树[嘻嘻]如果城市的空闲边角地拿出来，引导市民参与城市绿化，不仅有利于降低现行城市绿化模式的高昂成本，更是通过全民参与建设城市，倡导一种可持续性的城市生活方式 $: 不见得全种菜和果树[嘻嘻]如果城市的空闲边角地拿出来，引导市民参与城市绿化，不仅有利于降低现行城市绿化模式的高昂成本，更是通过全民参与建设城市，倡导一种可持续性的城市生活方式 ,1,"['1401745752', '1798276751', '2729872013', '1871867714']",: 不见得全种菜和果树[嘻嘻]如果城市的空闲边角地拿出来，引导市民参与城市绿化，不仅有利于降低现行城市绿化模式的高昂成本，更是通过全民参与建设城市，倡导一种可持续性的城市生活方式$先把各大高尔夫球场种上菜放上羊，不去香港买奶粉$哪天走路 渴了 直接摘个水果吃。$不怕汽车尾气的重金属污染吗？能吃吗？
1759,#安全食品# 爱如光！所到之处，自私、贪婪、黑暗，会分崩离析！不公、不义和恐惧会退缩投降！安图作为安全食品社会化企业，为生产安全食品的农人提供全程服务，做好消费者的安全食品把关人！在二月二龙抬头的日子，中国首家安全食品体验店欢迎农人免费进驻！安全食品论坛也将在近期推出，敬请关注。 ​​​,2013-5-13,0,[],1,"['579922049', '3021545467', '744022423', '2919485622', '2920231464', '579922049', '1155044362']", $:社会化的企业，专注食品安全，通过展厅和主题活动，把生产者和消费者联系起来。是时候了 $:社会化的企业，专注食品安全，通过展厅和主题活动，把生产者和消费者联系起来。是时候了 $:转发微博 $:转发微博 $ $ ,0,[],
