Num,Post,Date,Like,Like_ID,Share,Share_ID,Share_Content,Comment,Comment_ID,Comment_Content
1,这位丹麦来的导演很爱听我们的故事，觉得我们不容易很辛苦，但是我们却很开心。开始的消费者最后却都成了我们的朋友，导演问你们的客户除了市集上还有从哪里来的。我们说都是朋友互相介绍的，对待朋友就像家人真心真意不能有半点虚假，这样才能让更多的人相信你。还是那句话把良心放到土地里，为大家结 ​​​ 全文,2017-8-31,9,"['1509647473', '5769296863', '6189662128', '6068383117', '6353801707', '1726000707', '2435587595', '3147837312', '1762097564']",4,['3167809281'],:[good][good] ,5,"['6417419037', '1412842432', '579922049', '2435587595']",:萝卜缨子可以喂些土鸡田鸭么？怎么没见养些食肉的家畜(⊙o⊙)哇？[疑问][晕]$请问土豆和胡萝卜在哪卖，有网店吗？$:打碎还田，当肥料$那个秧子干什么用？
2,#产地拜访#上周和@北京有机农夫市集 伙伴一起， 一天往返700多公里，去河北张家口拜访@一墩青 和@快乐返乡青年 。成哥家嫂子炖的土豆南瓜香的舌头打卷，糖拌西红柿汁水丰盈细腻鲜甜！蹲在地头啃西瓜爽的不要不要的！小黄一家带我们上山杏树林给我们讲穴施施肥法，儿子在树林里爬上爬下玩的不亦乐乎，回 ​​​ 全文,2017-8-29,3,"['1157222840', '1700530055', '5886091360', '1687274110']",2,"['2092577903', '579922049']",:转发微博 $:张家口我们两家做的最小，就凭自己还有把子力气还要连带家人，还好儿子是我的希望动力满满的。[嘻嘻] ,3,['3719047295'],不错不错
3,最近一直在忙着收秋没能及时回复大家敬请谅解吧！[作揖]小麦今年产量还可以每亩二百斤，土豆和胡萝卜也到收获的时候了。争取在十月一号前全部收完。 ​​​,2017-8-28,6,"['6068383117', '3123820267', '2600361967', '1274539005', '1747037187', '3182549883']",2,['5819340028'],:转发微博 ,11,"['1350171974', '3291684251', '6353801707', '579922049', '579922049', '579922049', '579922049', '2435587595']",沉甸甸的果实[微风][微风][微风]看着开心[微笑]$请问紫色的土豆是转基因的吗？小时候从未见过紫色土豆呢$欢迎关注澳洲活力农耕，一起研究改良土壤，提高作物品质的好方法。$:【快乐返乡青年生态农场】，复制这条信息￥le1M0WAPRG5￥后打开[向右]手机淘宝[向左]$:玉兰，老品种自留种，价格看微店$:是的，很不错了。靠天吃饭，不下雨就颗粒无收$:我们的成本也许比他们的低$也就是你家的土豆胡萝卜洋葱还便宜点
4,不好意思挺长时间没在微博上宣传了，其实今年夏天我们也算挺忙的，去北京赶集买完货就开始种地，种完没几天开始收杏仁，往杏地理施有机肥，这不马上小麦开始收了，下来就是收燕麦，土豆，胡萝卜。小米最晚11月份才能有。这一年不紧不慢也没几天休息。其实冬天才是最忙的时候。 ​​​,2017-8-15,11,"['6068383117', '5694626726', '1645964357', '5889168233', '3123820267', '1751798575', '1762097564', '2804454202', '2115692730', '1283849072']",2,['1879619105'],:充实而快乐，羡慕…… ,4,"['579922049', '2114173421', '2435587595', '2115692730']",:不好意思回复您太晚了，我们的店铺名就是快乐返乡青年生态农场$你们家有淘宝店吗$[太开心]好文艺的拍照$充实而快乐，羡慕……
5,天下钓鱼 http://t.cn/RtZcf3f ​​​,2017-8-15,1,['5120313855'],0,[],,0,[],
6,从小不喜欢去田里干活，结果做梦都没想到居然爱上了种地并且坚持了下来。家乡的美景和庄稼漂亮而又健壮。我的土豆就是这样长大的。 ​​​,2017-6-18,2,"['3895510502', '1859544720', '1068904472', '5537225037', '1274539005', '5144116980']",1,['579922049'],  欢迎到我的老家康巴诺尔来做客，最近干旱的厉害赶快浇灌。 ,1,[],
7,从小不喜欢去田里干活，结果做梦都没想到居然爱上了种地并且坚持了下来。家乡的美景和庄稼漂亮而又健壮。我的土豆就是这样长大的。 ​​​,2017-6-18,6,"['3895510502', '1859544720', '1068904472', '5537225037', '1274539005', '5144116980']",5,['579922049'],  欢迎到我的老家康巴诺尔来做客，最近干旱的厉害赶快浇灌。 ,0,[],
8,由于北方的常年平均气温较低，粪肥发酵缓慢每年种地的农民赶不上发酵完全就上到地里。生粪用到地里会生虫害，因此就必须打药来控制，我今年用的发酵剂加快粪肥发酵速度，经过高温发酵不仅可以杀死虫卵还可以灭掉杂草种子，真希望老家种菜的农户也能用这种方法。不用打药不用除草剂。 ​​​,2017-5-9,4,"['2740066065', '1657860211', '5043167225', '1177938582']",2,['5043167225'],:转发微博 ,1,['5534436519'],有什么环保驱虫方法。
9,种地要深耕也要分种什么，种土豆必须要深耕才能把去年的茬子深翻到地里提高保水量。 秒拍视频 . ​​​,2017-5-8,0,[],0,[],,0,[],
10,土豆已经种完，再等五月中旬种燕麦。土豆发芽要半个月甚至更长时间，北方天气寒冷种完土豆还下了场雪，下一步土豆出芽培土该浇水了。今年还种了专门炸薯条的土豆，冬天可以给小朋友做薯条了。 ​​​,2017-5-8,4,"['3282294903', '5047889941', '1751798575', '1657860211']",3,['5686057297'],:期待新一年的土豆~[馋嘴] ,2,['5686057297'],期待新一年的土豆~[馋嘴]
11,高原气候还是很冷，风刮的脸还很疼。堆肥温度还是很高的 4天上到64度，由于时间紧迫直接拉到地里也就等于翻堆了在地里再次发酵。 ​​​,2017-4-11,4,"['2435587595', '6034513437', '3162477211', '2719898561']",2,[],,0,[],
12,土豆卖完回来就开始准备粪肥，为了赶时间用EM菌加快发酵。可怜父母本不想让他们累了自己哪怕多干几天也没事，可是他们不愿意看我自己累多少都要帮的干。200克一袋菌加2斤玉米面发酵五吨肥。我用了6袋还不够估计加少了。现在就等升温发酵了。 ​​​,2017-4-6,3,"['2682665271', '1007666255', '2435587595']",2,['1862532991'],:转发微博 ,0,[],
13,清仓土豆5斤红白混搭，除偏远地区外，大部分地区包邮，数量不多，卖完为止，想吃等9月才会有新的  http://t.cn/R6MVEvj，最后几百斤马上就没了。 ​​​,2017-3-25,4,"['2507560660', '1751798575', '1746789302', '2435587595']",0,[],,2,['1996464981'],今天在市集买了一袋15元，回家打开发现几乎每个土豆都有很多芽眼，而且不少已经发出了芽，这样的不会有毒素吗。早知如此，就买8块一斤的吃个放心了
14,今年土豆虽然丰收但是雨量较大土豆皮薄易破损，没办法只有把最好的没有一点伤疤的给客户，带伤的太多几乎破皮有三分之二。破皮的土豆就是外观不好看有干伤里面还是和好土豆一样的。所以今天开始特价处理30元7斤运费自理，家里冷藏或阴凉处放一到俩周没问题，淘宝微店都可以拍。特价土豆半价出售/品相不好/每箱7斤/泡沫箱发货/建议半个月吃完 ​​​,2017-2-9,1,['1273057790'],0,[],,1,[],
15,#年货大集#本周末三集！周五、周六两天五彩城年货大集，同时周六三元桥凤凰商街开集！马上要过春节，市集特别策划，带来整两天的有机农夫年货大集，除了靠谱放心有机出产的好食材外，还有各类民俗和环保小活动，让大家逛得舒心，吃得健康，过一个充实美味的春节！[围观][围观]除了本地农友食材，还 ​​​ 全文,2017-1-20,4,"['3182549883', '1765926591', '6100025798', '5587914316', '1988461523']",0,[],,0,[],
16,亲们！过年的饺子面准备好了吗？悄悄告诉您，我家的面粉包饺子好好吃哦！现在还买2包送玉米面或大黄米面，还不快戳！老品种小麦粉/迎新年大促买2包送玉米面或大黄米面/中高筋/2500g ​​​,2017-1-3,0,[],0,[],,0,[],
17,这么多照片都是市集给我留下的点滴，非常感谢。希望能全年都参加市集给客户带来更多安全可靠的食物。 ​​​,2016-12-24,9,"['5597189830', '2740066065', '1578644800', '2435587595', '1596858933', '5815669173', '1402226723', '1746789302', '2703530915']",2,['316608889'],:笑容一直没变啊 ,2,"['2214838733', '5516731834']",[good]$笑容一直没变啊
18,#开集啦#今天老地方崇文门新活馆二楼开集喽，已经能感受到圣诞节的气氛啦，开集时间下午一点结束，集友们快来赶集，今天有二十家农友来崇文门~赶集购买农友食材做顿平安夜大餐喽~[围脖][围脖][蛋糕][蛋糕]明天还有三元桥集室三周年庆市集，今明赶集农友名单戳：集室趣记（下篇）：一个社区小菜店的一年 ​​​,2016-12-24,1,"['2872309424', '1746789302']",0,[],,2,['2140508523'],平人农场草莓明天有吗 怎么卖的
19,今日市集，@沃翠源 新推出了九蒸九晒的醋泡黑豆，养气补肾，味道还很不错越嚼越香！蘑菇哥难得蘑菇的产量跟上，不用担心买不到啦[鼓掌]@分享收获CSA 竟然有这么多的西红柿，大冬天实属不易！@乐活村-乐活先生 鸡蛋依旧买二送一，@快乐返乡青年 破皮土豆20/5斤，再实惠不过！最豪的当属@米酒先生 家，今 ​​​ 全文,2016-12-15,4,"['2718876673', '5388632800', '5151037817', '1915085262', '2747799077', '1746789302', '1215694204']",0,[],,0,[],
20,村里的人走出去的很多留下了破烂不堪的房屋，同时也留下了美好的环境。屋后的黄花菜开了也预示这杏熟了，被虫子咬过的杏提前掉了下来，每年要拾一个多月的杏才能全部收完。每年8月份是西红柿下来的季节，摘完杏开始吃西红柿。明年又要种村里老品种西红柿，记得来吃很甜很沙。 ​​​,2016-12-13,17,"['2854281144', '1299066733', '5047889941', '5205600457', '2740066065', '1762097564', '1596939580', '2435587595', '1367508437', '2658361251']",1,[],,4,"['579922049', '2435587595']",:[good][赞]$世界上最好吃的東西是西紅柿和玉米[哈哈]
21,快乐返乡青年生态农场，双十二活动继续进行！买120，送价值12元的紫土豆一斤，紫土豆含丰富的花青素，可以预防衰老，不要错过机会哦！还有好多漂亮的豆豆！[心][围观][威武][耶] ​​​,2016-12-7,2,"['3109034657', '2435587595']",0,[],,1,['2649328897'],刚买一堆啊
22,快乐返乡青年生态农场最后一批洋葱从老家运来了，吃完就等明年了哦 ​​​,2016-12-6,0,[],0,[],,0,[],
23,好消息！双十二活动开始啦！即日起至12月12日，京津冀地区购物满120元的包邮！其他地方酌情减免运费！另送价值12元的紫土豆1斤，请亲拍下联系客服改价，如果直接付款，客服会在发货时核对运费，多付的直接退回到您的支付宝，谢谢各位的支持！快乐返乡青年生态农场 ​​​,2016-12-6,0,[],0,[],,0,[],
24,想自己做杏仁露的来我这里，自己动手。快乐返乡青年生态农场  http://t.cn/Rf8SCnR ​​​,2016-11-30,4,"['2435587595', '1402226723', '1746789302', '1862513305']",1,['2671383555'],:转发微博 ,0,[],
25,今年土豆虽然丰收但是雨量较大土豆皮薄易破损，没办法只有把最好的没有一点伤疤的给客户，带伤的太多几乎破皮有三分之二。破皮的土豆就是外观不好看有干伤里面还是和好土豆一样的。所以今天开始特价处理30元7斤运费自理，家里冷藏或阴凉处放一到俩周没问题，淘宝微店都可以拍。特价土豆半价出售/品相不好/每箱7斤/泡沫箱发货/建议半个月吃完 ​​​,2016-11-25,1,['1273057790'],1,"['579922049', '579922049', '579922049', '579922049']",: 这周还会带破皮土豆，想买家里爱吃的要提前去哦！ $:这周还会带破皮土豆，想买家里爱吃的要提前去哦！ $ 希望让更多爱吃土豆的人们得到这实惠价的消息 $ 希望让更多爱吃土豆的人们得到这实惠价的消息。谢谢大家！ ,0,[],
26,我获得了@微博会员 发来的红包20.00元。 ​​​,2016-11-24,0,[],0,[],,0,[],
27,#开集通知#本周末双集，周六10:00-13:00，崇文门新活馆2层（崇文门东打磨厂街7号，祈年大街路口）；周日10:00-13:00，三元桥凤凰商街，@集室 门口。[围观][围观]周末双集详情及农友名单请戳链接：来赶集，在北京也能吃到法国金奖奶酪！(内附周末大集农友名单) [鼓掌][鼓掌]文中还有@布乐奶酪 掌柜刘阳老师推荐的奶酪小食做法哦；另外周日下午在 ​​​ 全文,2016-11-24,3,"['1665031561', '3070672400']",1,"['5064013702', '579922049', '2036543795']",:要去！屯点儿吃的 $:这周市集我们会带着真诚的微笑和足足的货物来与你相会！ $:这周末的市集是我2016年的最后两个集了，在赶集就是明年3月份了，想在家里猫冬了，如果亲们有要买菜和鸡和鸡蛋的可以加我微信，电话也可以13810366411 ,0,[],
28,我们家羊粪种的土豆在运输当中有些破损其实就是外表有些干伤里面和好的一样。没有别的意思只是想告诉大家我们有时过高的要求把自己害了。就拿土豆来说，大家都想要大的好看的没有破损的，好，现在各大市场超市几乎全能满足你，但是你知道你的要求全是农药换来的，化肥，膨大素，防菌剂老化剂。这些会致 ​​​ 全文,2016-11-23,0,[],0,[],,0,[],
29,今年土豆虽然丰收但是雨量较大土豆皮薄易破损，没办法只有把最好的没有一点伤疤的给客户，带伤的太多几乎破皮有三分之二。破皮的土豆就是外观不好看有干伤里面还是和好土豆一样的。所以今天开始特价处理30元7斤运费自理，家里冷藏或阴凉处放一到俩周没问题，淘宝微店都可以拍。特价土豆半价出售/品相不好/每箱7斤/泡沫箱发货/建议半个月吃完 ​​​,2016-11-18,3,['1273057790'],0,[],,0,[],
30,今年土豆虽然丰收但是雨量较大土豆皮薄易破损，没办法只有把最好的没有一点伤疤的给客户，带伤的太多几乎破皮有三分之二。破皮的土豆就是外观不好看有干伤里面还是和好土豆一样的。所以今天开始特价处理30元7斤运费自理，家里冷藏或阴凉处放一到俩周没问题，淘宝微店都可以拍。特价土豆半价出售/品相不好/每箱7斤/泡沫箱发货/建议半个月吃完 ​​​,2016-11-17,2,['1273057790'],4,"['579922049', '579922049', '579922049', '579922049']",: 这周还会带破皮土豆，想买家里爱吃的要提前去哦！ $:这周还会带破皮土豆，想买家里爱吃的要提前去哦！ $ 希望让更多爱吃土豆的人们得到这实惠价的消息 $ 希望让更多爱吃土豆的人们得到这实惠价的消息。谢谢大家！ ,1,[],
31,今年土豆虽然丰收但是雨量较大土豆皮薄易破损，没办法只有把最好的没有一点伤疤的给客户，带伤的太多几乎破皮有三分之二。破皮的土豆就是外观不好看有干伤里面还是和好土豆一样的。所以今天开始特价处理30元7斤运费自理，家里冷藏或阴凉处放一到俩周没问题，淘宝微店都可以拍。特价土豆半价出售/品相不好/每箱7斤/泡沫箱发货/建议半个月吃完 ​​​,2016-11-17,1,['1273057790'],7,"['579922049', '579922049', '579922049', '579922049']",: 这周还会带破皮土豆，想买家里爱吃的要提前去哦！ $:这周还会带破皮土豆，想买家里爱吃的要提前去哦！ $ 希望让更多爱吃土豆的人们得到这实惠价的消息 $ 希望让更多爱吃土豆的人们得到这实惠价的消息。谢谢大家！ ,0,[],
32,快乐返乡青年/亚麻籽粉/高温容易氧化，请置于冰箱冷藏     亚麻籽粉是由亚麻籽加工而成，亚麻籽中富含人体必需脂肪酸α-亚麻酸，膳食纤维，木酚素及丰富的氨基酸、镁、锌等营养物质。其中α-亚麻酸是ω-3脂肪酸（DHA、EPA）的前体物质，所含的木酚素是其他植物的100-800倍，对人体具有很好的保健作用。 现代人近年的饮食习惯改变， ​​​ 全文,2016-11-16,0,[],0,[],,1,['579922049'],新磨的亚麻籽粉哦！为保证新鲜，一个月磨一次！
33,#开集通知#本周末双集，周六10:00-13:00，崇文门新活馆2层（崇文门东打磨厂街7号，祈年大街路口）；周日10:00-13:00，三元桥凤凰商街，@集室 门口；[围观][围观][围观]冬天来啦，是什么能促使你离开温暖的被窝，走出家门呢？对于小编来说，当然是每周的周末大集啦：冬日聚会 | 本周双集，周六崇文门 周日三元桥凤凰商街等你来！ ​​​,2016-11-11,4,"['1897667223', '1849847155', '1969031857', '5545500805', '2099375404', '1893659263', '2650542502', '1807191825']",1,"['5444420665', '2218223525', '579922049', '2170470811', '2542436612', '577229168']",:转发微博 $:周末赶集走起呦！ $:这周市集我们的新小米下来了会带些，土豆放一段时间越来越好吃了。从返乡到现在产品基本定位了，接下来需要进一步把土地改良好。为大家保持健康的产品没问题的前提下就是提升口感了。一步一个脚印踏实的走下去还是那句话 “把良心种到地里，良心在一切都在”。 $:明天是崇文门市集，我们家会带来山货：蓝莓酱，蓝莓汁，蔓越莓酱，蔓越莓汁，花草茶，玫瑰酱。另外，我们还会带来今年的新品：古源大南瓜，自家种的。还有一个就是土蘑，很鲜很香的野蘑菇。我们还会带去松仁，松籽，松果，让大家充分了解松仁的每一个细节。 $: 乐活村参加周末崇文门和三元桥市集，产品有鸡、鸡蛋、玫瑰纯露、山楂干和山楂果酱。 $:乐活村参加周末崇文门和三元桥市集，产品有鸡、鸡蛋、玫瑰纯露、山楂干和山楂果酱。 ,2,"['1980351653', '1980351653', '1871740373', '2218223525', '2698959362', '2170470811']",:[好]谢谢，明天去看看[嘻嘻]$有卖嫩姜的吗？$周日还有大集吗？预报说雾霾很严重……$周末赶集走起呦！$天津有这样的集市吗$明天是崇文门市集，我们家会带来山货：蓝莓酱，蓝莓汁，蔓越莓酱，蔓越莓汁，花草茶，玫瑰酱。另外，我们还会带来今年的新品：古源大南瓜，自家种的。还有一个就是土蘑，很鲜很香的野蘑菇。我们还会带去松仁，松籽，松果，让大家充分了解松仁的每一个细节。
34,新磨小米已经下来了，需要的赶快淘宝微店拍吧！ ​​​,2016-11-4,3,"['5597189830', '5205600457', '2435587595']",1,['6018688888'], 好黄的小米 ,2,"['6018688888', '579922049']", 好黄的小米$:好的
35,特价胡萝卜有要的没？虫咬的，长得丑的，个头太大，不影响食用，自己家吃很实惠，送给不注重外貌只注重内涵的亲！[坏笑][兔子][围观]http://t.cn/RVYk3Qa ​​​,2016-10-27,2,['1762097564'],3,"['3192497570', '1421141511', '1421141511', '579922049', '1404651352']", 家今年胡萝卜长得个头大了，[笑cry]不太好看，特价优惠销售大家看过来~[哈哈] $:还有要的没？下午可以发货哦[可爱][亲亲][耶] $:还有要的没？下午可以发货哦[可爱][亲亲][耶] $:还有要的没？下午可以发货哦[可爱][亲亲][耶] $ 家今年胡萝卜长得个头大了，[笑cry]不太好看，特价优惠销售大家看过来~[哈哈] ,0,[],
36,特价胡萝卜有要的没？虫咬的，长得丑的，个头太大，不影响食用，自己家吃很实惠，送给不注重外貌只注重内涵的亲！[坏笑][兔子][围观]http://t.cn/RVYk3Qa ​​​,2016-10-26,1,['1762097564'],7,"['3192497570', '1421141511', '1421141511', '1404651352']", 家今年胡萝卜长得个头大了，[笑cry]不太好看，特价优惠销售大家看过来~[哈哈] $:还有要的没？下午可以发货哦[可爱][亲亲][耶] $:还有要的没？下午可以发货哦[可爱][亲亲][耶] $ 家今年胡萝卜长得个头大了，[笑cry]不太好看，特价优惠销售大家看过来~[哈哈] ,0,[],
37,已经进入秋末，北方幸苦多半年的农民开始闲下来了。为了产出更好的大杏仁给杏树地增加有机质，我们请来了广州沃土池田秀夫弟子彭月丽老师作指导。山路崎岖只能用骡子车把彭老师接到地里，现场指导穴贮堆肥技术。我们这里四季干旱有机质含量少，只要增加1%的有机质就会提高保水保肥4到6倍。一定要好好做 ​​​,2016-10-25,4,"['1646189380', '1787139617', '1747037187', '2435587595']",3,['6018688888'], 骡子大车 ,1,['6018688888'], 骡子大车
38,美味的芝士焗土豆泥做法~超简单，学不会你打我#烘焙很简单YOU# ​​​,2016-10-25,1,"['6104676268', '2115275054', '5040130233', '3886734780', '5220226279', '2037172724', '1888818523', '5372689849', '5017303537', '1746479447']",0,[],,0,[],
39,今年胡萝卜种的有点稀再加上原来种过土豆的地上了好多羊粪，所以就长成现在很大的样子。明年我们会把选种种植的视频一步一步拍好，让大家看的详细吃的放心。大家最近的疑问很多我觉得是我们没有做到透明化没有让大家提前知道造成的。谢谢你们的关心！我们会做好的。 ​​​,2016-10-20,4,"['5866531868', '1817858667', '2435587595', '1966000347']",8,"['2435587595', '2296102483', '1879995955']",:我想挖個地窖，[月亮]藏胡蘿蔔土豆洋蔥大白菜青蘿蔔。 $:我家就是怀来的，真心觉得你们不容易，务农不是城里人想象的那样简单，农耕所付出的一点一滴都真心不易，敬佩你们 $:我家就是怀来的，真心觉得你们不容易，务农不是城里人想象的那样简单，农耕所付出的一点一滴都真心不易，敬佩你们 ,6,"['579922049', '579922049', '1132867614', '1106368290']",:谢谢老乡理解，好多人认为色自己热爱农业不断加入其中，其实农业是要承担风险和身体的劳累还有短期没效益。结果受不了只能赔钱退出。我们整整一年在地里劳作真是风里来雨里去，好的客户还理解，遇见难缠的还要被诋毁。希望人们能理解农业，农业是一切的生存资本。$:谢谢，加油$转基因的吗$很虚心，一定会越来越好的。加油[干杯]
40,#开集通知#本周末双集！周六10:00-13:00，崇文门新活馆二楼；周日10:00-13:00，三元桥凤凰商街。[围观][围观]两大亮点：生态种植的西畔山洲靠谱橘子到京，无农药化肥除草剂保鲜剂。去年酸甜有滋味的橘子一定给大家带来深刻印象，周末双集，捐赠二手袋在市集接待处有橘子赠送，欢迎大家多多赶集购买！ ​​​ 全文,2016-10-20,2,"['1193232584', '2405698917', '2704439943', '1746789302']",2,"['1899919855', '51795279', '111989426', '2218223525', '2703530915', '3082403235', '1482254622']",:转发微博 $:天气降温，来碗醪糟，煮个鸡蛋。 $ $:本周活动好丰富啊[色][色][色]！ $:终于可以轻松赶集了朋友们，周末见哈[嘻嘻][嘻嘻][礼物] $ ，有荞麦面啦，先到先得哈 $:周日要去逛二手厨房市集，淘换点漂亮的厨具 ,6,"['5624132269', '2736199113', '51795279', '2218223525', '2660105920', '577229168', '2082552647']",大家好！我是芦花春品牌联合创始人之一，我是一个来自农村，定居于城市，又回到广阔天地的新农人。 2015年3月，我和我的小伙伴们辞去国企稳定的工作，回到农村，承包120多亩天然杏树林，与山东省汶上县芦花鸡协会（芦花鸡产地）进行引种合作，成立芦花鸡协会蔚县分会，致力于打造农村到餐桌零环节的24 $橘子多少钱一斤？$天气降温，来碗醪糟，煮个鸡蛋。$本周活动好丰富啊[色][色][色]！$:[嘻嘻]$乐活村参加周末双集，鸡蛋优惠，50元三盒，树熟山楂开卖，自己做果酱的朋友可以动手了。$求微店链接[來][來]
41,开花馒头好吃有营养一定要用麸子胚芽面。我家的小麦胚芽全在细麸子里。 张家口·张纪镇 ​​​,2016-10-17,5,"['5309498028', '2603079851', '5015360535', '2435587595', '3311927983', '5120313855', '2688788590', '2672969447']",5,"['3831457732', '3192497570', '1418390662', '5466319451', '579922049', '5269279653']",:面粉又开始卖了，新麦磨出好面粉。 $:面粉又开始卖了，新麦磨出好面粉。 $:面粉又开始卖了，新麦磨出好面粉。 $:面粉又开始卖了，新麦磨出好面粉。 $:面粉又开始卖了，新麦磨出好面粉。 $:转发微博 ,13,"['1025894963', '1502353905', '579922049', '1502353905', '579922049', '1502353905', '579922049', '1244491982']",下单去$:噢，等天儿凉$:[嘻嘻]主要是馒头不好运输，怕路上坏了，我手艺也不行，不是每次都蒸得那么好。$:亲懒，亲笨，亲不会蒸馒头$:不卖馒头，只卖面粉，亲！$买馒头啊想$，亲，你好，这个是细麸子，您可以和精面粉一起买，想吃饺子面条不用掺，想吃馒头老板就加一点细麸子，还有全麦粉：$麸子胚芽面去哪买？
